,wordscore,most_freq_target_words,most_freq_all_words,study_design_hunch,impact_of_study_hunch,tech_words_freq,_doi,_title
3821,2,"[('bias', 1)]","[('and', 9), ('to', 7), ('the', 6), ('motivation', 4)]","[('survey', 1), ('study', 1), ('research', 1), ('test', 1)]",[],"[('data', 1)]",10.1016/j.jesp.2022.104310,Reframing of moral dilemmas reveals an unexpected “positivity bias” in updating and attributions
3824,4,[],"[('and', 13), ('the', 12), ('in', 12), ('is', 9)]","[('articles', 1), ('negative', 1), ('positive', 1), ('difference', 1)]","[('finding', 1)]","[('web', 1), ('online', 1), ('data', 1)]",10.5406/19398298.135.1.01,How We Tell Apart Fiction from Reality
3826,3,"[('design', 1), ('social', 1)]","[('in', 12), ('the', 9), ('of', 8), ('and', 8)]","[('negative', 1), ('experiment', 1), ('meta-analysis', 1), ('positive', 1)]",[],"[('social', 1)]",10.1177/17456916211044140,A Psychology of Ideology: Unpacking the Psychological Structure of Ideological Thinking.
3827,2,"[('social', 1)]","[('and', 8), ('intergroup', 6), ('of', 5), ('contact', 5)]","[('positive', 1), ('suggest', 1), ('negative', 1), ('research', 1)]",[],"[('social', 1)]",10.1016/j.neunet.2020.06.008,A neurodynamic model of the interaction between color perception and color memory
3830,2,[],"[('contact', 12), ('and', 7), ('as', 6), ('to', 6)]","[('review', 1), ('research', 1), ('positive', 1), ('intervention', 1)]","[('intervention', 1)]","[('online', 1)]",10.18800/psico.202102.005,"Eventos locales, efectos globales: emociones trascendentes e identificación con toda la humanidad"
3832,3,"[('behavior', 1), ('human', 1), ('exposure', 1)]","[('the', 12), ('to', 6), ('sms', 5), ('in', 4)]","[('control', 1), ('experiment', 1)]",[],[],10.1016/j.ijhcs.2022.102802,Development and validation of a social robot anthropomorphism scale (SRA) in a french sample
3835,2,"[('human', 1), ('dehumanize', 1)]","[('the', 11), ('in', 8), ('of', 7), ('was', 7)]","[('positive', 1), ('recent', 1), ('study', 1), ('suggest', 1)]",[],[],10.1111/jtsb.12327,The taboo against contact with minorities: A folk‐anthropology approach to prejudices
3837,2,"[('human', 1)]","[('in', 7), ('the', 7), ('to', 5), ('of', 4)]","[('analysis', 1), ('found', 1)]","[('increase', 1)]",[],10.1016/j.jenvp.2022.101783,The roots of ecological dominance orientation: Assessing individual preferences for an anthropocentric and hierarchically organized world
3838,3,"[('social', 1)]","[('of', 9), ('and', 8), ('the', 8), ('organizational', 6)]","[('survey', 1), ('study', 1), ('suggest', 1), ('impact', 1)]","[('increase', 1)]","[('social', 1)]",10.1016/j.jesp.2022.104303,The way they look: Phenotypic prototypicality shapes the perceived intergroup attitudes of in- and out-group members
3844,2,"[('exposure', 1), ('experience', 1)]","[('racial', 12), ('the', 12), ('to', 10), ('of', 9)]","[('control', 1), ('negative', 1), ('positive', 1), ('study', 1)]",[],[],10.1177/1475240920978712,The cultural group in intercultural understanding: implications for teaching from a social identity theory perspective
3848,2,"[('design', 1), ('users', 1)]","[('and', 8), ('of', 7), ('the', 5), ('to', 3)]","[('field', 1), ('analyze', 1), ('research', 1), ('articles', 1)]",[],[],10.1007/978-3-030-86190-2,"Communication in Peacebuilding, Civil Wars, Civility and Safe Spaces"
3849,3,"[('behavior', 1), ('counter', 1), ('experience', 1)]","[('to', 8), ('expectations', 7), ('and', 7), ('research', 6)]","[('negative', 1), ('positive', 1), ('predictions', 1), ('research', 1)]",[],[],10.1177/01650254211066768,"Trust, forgiveness, and peace: The influence of adolescent social identity in a setting of intergroup conflict"
3856,3,"[('media', 1), ('social', 1)]","[('the', 25), ('and', 14), ('this', 8), ('to', 8)]","[('questionnaire', 1), ('survey', 1), ('study', 1), ('research', 1)]",[],"[('online', 1), ('data', 1), ('media', 1), ('social', 1)]",10.1016/j.jesp.2022.104313,"How morality signals, benefits, binds, and teaches"
3857,3,"[('design', 1), ('social', 1)]","[('in', 12), ('the', 9), ('of', 8), ('and', 8)]","[('negative', 1), ('experiment', 1), ('meta-analysis', 1), ('positive', 1)]",[],"[('social', 1)]",10.1111/pops.12811,MOBILISE: A Higher‐Order Integration of Collective Action Research to Address Global Challenges
3858,2,"[('social', 1)]","[('attitudes', 12), ('outgroup', 10), ('our', 9), ('friends', 9)]","[('found', 1), ('study', 1), ('research', 1), ('model', 1)]",[],"[('social', 1)]",10.1037/sah0000370,Implicit and Explicit Dehumanization of Older Family Members: Novel Determinants of Elder Abuse Proclivity
3859,5,"[('social', 1), ('bias', 1)]","[('and', 22), ('the', 12), ('of', 11), ('religious', 9)]","[('research', 1), ('argue', 1), ('negative', 1)]",[],"[('reach', 1), ('social', 1), ('community', 1)]",10.1145/3479537,&#x27;Walking Into a Fire Hoping You Don&#x27;t Catch&#x27;: Strategies and Designs to Facilitate Cross-Partisan Online Discussions
3860,2,"[('bias', 1)]","[('and', 9), ('to', 7), ('the', 6), ('motivation', 4)]","[('survey', 1), ('study', 1), ('research', 1), ('test', 1)]",[],"[('data', 1)]",10.1037/pspi0000342,Multiple Categorization and Intergroup Bias: Examining the Generalizability of Three Theories of Intergroup Relations
3863,2,"[('social', 1)]","[('acculturation', 7), ('and', 5), ('a', 5), ('of', 5)]","[('negative', 1), ('positive', 1), ('study', 1), ('research', 1)]",[],"[('social', 1)]",10.3389/fphar.2021.750193,"Geographical, Socioeconomic, and Gender Inequalities in Opioid Use in Catalonia"
3864,2,[],"[('the', 16), ('of', 6), ('for', 6), ('study', 4)]","[('analysis', 1), ('study', 1), ('model', 1), ('impact', 1)]",[],"[('digital', 1), ('data', 1)]",10.14475/jhpc.2022.25.1.1,Problems Related to the Act on Decisions on Life-Sustaining Treatment and Directions for Improvement
3865,2,"[('rated', 1), ('social', 1), ('bias', 1)]","[('the', 7), ('of', 5), ('in', 5), ('candidates', 5)]","[('research', 1), ('suggest', 1), ('interview', 1)]",[],"[('social', 1), ('video', 1)]",10.1515/sjpain-2021-0163,Temperament and character dimensions differ in chronic post-surgical neuropathic pain and cold pressure pain
3868,2,"[('trust', 1)]","[('and', 11), ('climate', 8), ('the', 8), ('of', 7)]","[('analysis', 1), ('research', 1), ('overall', 1), ('article', 1)]",[],"[('data', 1)]",10.1007/s40122-022-00359-z,"Racial Differences in Pain, Nutrition, and Oxidative Stress"
3869,2,"[('design', 1), ('social', 1), ('experience', 1)]","[('and', 17), ('interactions', 11), ('of', 8), ('the', 8)]","[('found', 1), ('study', 1), ('research', 1), ('suggest', 1)]","[('increase', 1)]","[('social', 1)]",10.1186/s12887-021-02715-y,Racial and ethnic disparities in opioid use for adolescents at US emergency departments
3872,2,[],"[('contact', 12), ('and', 7), ('as', 6), ('to', 6)]","[('review', 1), ('research', 1), ('positive', 1), ('intervention', 1)]","[('intervention', 1)]","[('online', 1)]",10.2106/jbjs.rvw.21.00161,"Race, Utilization, and Outcomes in Total Hip and Knee Arthroplasty"
3873,5,"[('human', 1), ('information', 1), ('social', 1)]","[('the', 13), ('in', 11), ('and', 10), ('to', 9)]","[('negative', 1), ('intervention', 1), ('experiment', 1), ('positive', 1)]","[('intervention', 1)]","[('social', 1)]",10.4103/2452-2473.329633,Pain management practices in the emergency departments in Turkey
3875,4,"[('experience', 1), ('social', 1), ('exposure', 1)]","[('of', 11), ('a', 11), ('and', 11), ('the', 10)]","[('analysis', 1), ('study', 1), ('model', 1)]","[('increase', 1)]","[('community', 1), ('profile', 1), ('social', 1)]",10.1111/1475-6773.13968,Did prescribing laws disproportionately affect opioid dispensing to Black patients?
3877,2,"[('experience', 1)]","[('pain', 19), ('and', 11), ('to', 10), ('interference', 10)]","[('questionnaire', 1), ('follow-up', 1), ('multivariate', 1), ('analysis', 1)]",[],"[('data', 1)]",10.1002/cphy.c190038,"Baroreceptor Modulation of the Cardiovascular System, Pain, Consciousness, and Cognition"
3880,6,"[('prosocial', 1), ('behavior', 1), ('media', 1), ('social', 1)]","[('the', 16), ('of', 11), ('in', 10), ('and', 10)]","[('negative', 1), ('analysis', 1), ('analyze', 1), ('research', 1)]",[],"[('media', 1), ('social', 1)]",10.1007/s40615-022-01263-0,Anxiety Sensitivity Among Non-Hispanic Black Adults: Relations to Mental Health and Psychosomatic States
3887,6,"[('prosocial', 1), ('boost', 1), ('behavior', 1)]","[('in', 9), ('of', 6), ('and', 5), ('the', 4)]","[('suggest', 1), ('test', 1)]","[('increase', 1), ('compassion', 1)]","[('like', 1)]",10.29045/14784726.2021.9.6.2.10,An EXploration of the facilitators and barriers to paramedics&#x27; assessment and treatment of pain in PAediatric patients following Trauma (EX-PAT).
3890,2,"[('human', 1), ('experience', 1)]","[('the', 20), ('service', 16), ('to', 14), ('of', 12)]","[('field', 1), ('overall', 1), ('test', 1), ('study', 1)]",[],[],10.5811/westjem.2020.8.47450,Persistent and Widespread Pain Among Blacks Six Weeks after MVC: Emergency Department-based Cohort Study
3891,6,"[('prosocial', 1), ('boost', 1), ('behavior', 1)]","[('in', 9), ('of', 6), ('and', 5), ('the', 4)]","[('suggest', 1), ('test', 1)]","[('increase', 1), ('compassion', 1)]","[('like', 1)]",10.12688/f1000research.27725.2,Factors influencing non-adherence to opioids in cancer patients: a mixed-methods cross-sectional study
3898,2,"[('prosocial', 1), ('experience', 1)]","[('the', 15), ('to', 6), ('in', 6), ('of', 4)]","[('experiment', 1), ('overall', 1)]",[],[],10.1016/j.jocrd.2017.11.003,“What if I make a mistake?”: Examining uncertainty-related distress when decisions may harm oneself vs. others
3899,3,"[('social', 1), ('experience', 1)]","[('and', 12), ('a', 7), ('fictional', 7), ('narratives', 7)]","[('questionnaire', 1), ('found', 1), ('recent', 1), ('study', 1)]",[],"[('social', 1)]",10.1016/j.semperi.2021.151524,Addressing Bias and Disparities in Periviable Counseling and Care
3901,2,"[('experience', 1)]","[('and', 11), ('emotions', 7), ('nontarget', 6), ('in', 6)]","[('negative', 1), ('found', 1), ('overall', 1), ('positive', 1)]","[('compassion', 1)]",[],10.33160/yam.2022.02.005,"The Efficacy and Safety of Dexmedetomidine for Procedural Sedation in Patients Receiving Local Anesthesia Outside the Intensive Care Unit: A Prospective, Double-Blind, Randomized Clinical Phase III Trial in Japan"
3902,2,"[('information', 1)]","[('of', 15), ('mood', 12), ('and', 11), ('in', 8)]","[('subjects', 1), ('questionnaire', 1), ('analysis', 1), ('analysed', 1)]","[('decrease', 1)]",[],10.1007/s00520-021-06216-7,Interventions to improve cancer survivorship among Indigenous Peoples and communities: a systematic review with a narrative synthesis
3903,2,"[('social', 1)]","[('empathy', 8), ('the', 7), ('of', 6), ('i', 6)]","[('study', 1), ('research', 1)]",[],"[('social', 1)]",10.1007/s13164-022-00616-2,An Embodied Predictive Processing Theory of Pain Experience
3904,6,"[('prosocial', 1), ('experience', 1), ('human', 1), ('choice', 1)]","[('compassion', 12), ('to', 12), ('and', 9), ('that', 6)]","[('found', 1), ('positive', 1), ('difference', 1), ('study', 1)]","[('compassion', 1)]",[],10.29045/14784726.2021.9.6.2.10,An EXploration of the facilitators and barriers to paramedics&#x27; assessment and treatment of pain in PAediatric patients following Trauma (EX-PAT).
3907,3,"[('social', 1)]","[('to', 11), ('the', 9), ('and', 9), ('in', 7)]","[('analysis', 1), ('study', 1), ('research', 1), ('analyze', 1)]",[],"[('like', 1), ('social', 1)]",10.2147/jpr.s332447,Impact of Cannabis Use on Least Pain Scores Among African American and White Patients with Cancer Pain: A Moderation Analysis
3919,2,"[('design', 1), ('bias', 1)]","[('of', 9), ('ceo', 8), ('and', 8), ('the', 7)]","[('study', 1), ('negative', 1), ('impact', 1)]",[],[],10.1016/j.urology.2021.07.038,Trends in the Racial and Ethnic Diversity in the US Urology Workforce
3920,5,"[('behavior', 1), ('social', 1), ('accuracy', 1)]","[('the', 11), ('and', 9), ('in', 7), ('to', 6)]","[('field', 1), ('tested', 1), ('test', 1), ('research', 1)]",[],"[('social', 1), ('video', 1)]",10.1007/s40122-022-00359-z,"Racial Differences in Pain, Nutrition, and Oxidative Stress"
3926,4,"[('prosocial', 1), ('behavior', 1), ('social', 1), ('experience', 1)]","[('and', 13), ('empathy', 8), ('the', 7), ('to', 5)]","[('found', 1), ('survey', 1), ('study', 1), ('research', 1)]","[('decrease', 1)]","[('data', 1), ('social', 1)]",10.1016/j.pmn.2021.11.006,Sociodemographic and Clinical Characteristics Associated With Worst Pain Intensity Among Cancer Patients
3928,5,"[('prosocial', 1), ('behavior', 1), ('social', 1), ('guilt', 1)]","[('the', 19), ('in', 9), ('guilt', 7), ('for', 7)]","[('experiment', 1), ('research', 1), ('theoretical', 1)]",[],"[('social', 1)]",10.1016/j.xkme.2022.100443,Unstable Housing and Kidney Disease: A Primer
3933,3,"[('social', 1), ('experience', 1)]","[('the', 9), ('of', 9), ('intergroup', 7), ('conflict', 5)]","[('research', 1), ('suggest', 1), ('controlled', 1)]",[],"[('social', 1)]",10.1161/jaha.121.023446,Racial Disparities in Ion Channelopathies and Inherited Cardiovascular Diseases Associated With Sudden Cardiac Death
3936,3,"[('belief', 1), ('social', 1)]","[('extraverts', 4), ('are', 4), ('highly', 4), ('that', 4)]","[('propose', 1)]",[],"[('social', 1)]",10.2106/jbjs.rvw.21.00161,"Race, Utilization, and Outcomes in Total Hip and Knee Arthroplasty"
3937,2,"[('behavior', 1), ('social', 1), ('users', 1)]","[('of', 7), ('and', 7), ('the', 6), ('risks', 6)]","[('propose', 1), ('negative', 1), ('test', 1), ('analysis', 1)]",[],"[('privacy', 1), ('social', 1)]",10.1007/s11912-021-01170-3,Palliative Care in Paediatric Oncology: an Update
3939,2,"[('guilt', 1)]","[('and', 13), ('the', 11), ('of', 7), ('guilt', 5)]","[('found', 1), ('recent', 1), ('assessment', 1)]",[],"[('community', 1)]",10.1016/j.semnephrol.2021.10.008,Disparities in Mental Health and Well-Being Among Black and Latinx Patients With Kidney Disease
3941,4,"[('choice', 1), ('social', 1), ('exposure', 1)]","[('in', 9), ('the', 9), ('of', 8), ('mathematics', 7)]","[('competition', 1), ('survey', 1), ('study', 1), ('research', 1)]",[],"[('social', 1)]",10.3389/fpain.2021.779068,Quantitative Sensory Testing Across Chronic Pain Conditions and Use in Special Populations
3946,4,"[('design', 1), ('social', 1)]","[('i', 18), ('and', 14), ('of', 10), ('in', 9)]","[('study', 1), ('impact', 1), ('intervention', 1)]","[('increase', 1), ('compassion', 1), ('intervention', 1)]","[('digital', 1), ('social', 1)]",10.20473/jn.v15i2.21250,"KNOWLEDGE, ATTITUDE, AND CULTURE INFLUENCE VISUAL INSPECTION WITH ACETIC ACID SERVICE USE"
3952,3,"[('behavior', 1), ('rated', 1)]","[('the', 21), ('of', 13), ('and', 12), ('beauty', 10)]","[('control', 1), ('study', 1), ('pattern', 1), ('research', 1)]",[],"[('video', 1)]",10.1007/s13187-022-02152-0,Advancing Cancer Health Equity for African American Women
3955,4,"[('design', 1), ('information', 1), ('social', 1)]","[('the', 7), ('on', 6), ('of', 5), ('and', 5)]","[('control', 1), ('experiment', 1)]",[],"[('social', 1)]",10.1016/j.eclinm.2022.101303,Race and birth country are associated with discharge location from hospital: A retrospective cohort study of demographic differences for patients receiving inpatient palliative care
3956,4,"[('behavior', 1), ('social', 1)]","[('compliance', 7), ('of', 6), ('the', 6), ('social', 5)]","[('study', 1)]",[],"[('online', 1), ('social', 1)]",10.1016/j.jnma.2021.07.004,"Race, Ethnicity, and Other Sociodemographic Characteristics of Patients with Hospital Admission for Migraine in the United States"
3959,4,"[('social', 1)]","[('and', 12), ('a', 9), ('the', 8), ('in', 7)]","[('research', 1)]","[('increase', 1)]","[('data', 1), ('social', 1)]",10.1016/j.pmn.2022.01.007,"Patient Race, Ethnicity, Language, and Pain Severity in Primary Care: A Retrospective Electronic Health Record Study"
3961,3,"[('human', 1), ('social', 1)]","[('of', 11), ('and', 8), ('to', 6), ('social', 5)]","[('research', 1), ('suggest', 1), ('model', 1), ('review', 1)]",[],"[('social', 1)]",10.1016/j.jpedsurg.2021.09.048,"Assessing screening, brief intervention, and referral to treatment (SBIRT) compliance and disparities for pediatric inpatients at a tertiary care facility"
3964,2,"[('social', 1)]","[('and', 8), ('the', 7), ('expressions', 5), ('facial', 4)]","[('negative', 1)]",[],"[('social', 1)]",10.1080/17425255.2021.1998455,Novel models for the prediction of drug-gene interactions.
3968,3,"[('behavior', 1), ('social', 1)]","[('of', 7), ('moral', 7), ('social', 5), ('and', 5)]","[('study', 1), ('measure', 1), ('functional', 1)]",[],"[('social', 1)]",10.1016/j.jad.2020.09.057,Intranasal oxytocin and the stress-buffering effects of social support during experimentally induced pain: The role of attachment security
3969,2,"[('behavior', 1)]","[('to', 8), ('and', 7), ('in', 7), ('the', 5)]","[('survey', 1), ('experiment', 1), ('field', 1), ('test', 1)]",[],"[('data', 1)]",10.1016/j.pmn.2021.11.006,Sociodemographic and Clinical Characteristics Associated With Worst Pain Intensity Among Cancer Patients
3970,2,"[('prosocial', 1), ('experience', 1)]","[('the', 15), ('to', 6), ('in', 6), ('of', 4)]","[('experiment', 1), ('overall', 1)]",[],[],10.1007/s40122-022-00359-z,"Racial Differences in Pain, Nutrition, and Oxidative Stress"
3971,5,"[('design', 1), ('behavior', 1), ('nudge', 1), ('social', 1)]","[('the', 12), ('to', 7), ('in', 6), ('a', 5)]","[('subjects', 1), ('experiment', 1), ('overall', 1), ('study', 1)]",[],"[('social', 1)]",10.1038/s41372-022-01360-2,"Culturally competent care in the neonatal intensive care unit, strategies to address outcome disparities"
3972,5,"[('media', 1), ('social', 1)]","[('of', 9), ('in', 7), ('litter', 6), ('and', 6)]","[('analysis', 1), ('recent', 1), ('negative', 1), ('article', 1)]",[],"[('privacy', 1), ('media', 1), ('social', 1)]",10.1007/s40122-022-00359-z,"Racial Differences in Pain, Nutrition, and Oxidative Stress"
3978,6,"[('human', 1), ('user', 1), ('accuracy', 1), ('users', 1)]","[('a', 6), ('to', 5), ('of', 5), ('the', 3)]","[('found', 1), ('model', 1), ('analyzed', 1)]",[],"[('user', 1), ('video', 1)]",10.53424/balikesirsbd.963520,"Is There A Prognostic Significance For Copper, Beryllium, Boron, Titanium And Vanadium Ions In Prostate Cancer?"
3980,6,"[('prosocial', 1), ('user', 1), ('social', 1), ('media', 1)]","[('to', 4), ('social', 4), ('media', 3), ('of', 3)]","[('research', 1), ('positive', 1)]",[],"[('user', 1), ('media', 1), ('social', 1), ('content', 1)]",10.1016/j.jpain.2021.06.015,Applying the NIA Health Disparities Research Framework to Identify Needs and Opportunities in Chronic Musculoskeletal Pain Research
3981,5,"[('voice', 1), ('choice', 1), ('human', 1), ('social', 1)]","[('of', 10), ('the', 7), ('that', 6), ('to', 5)]","[('control', 1), ('predictions', 1), ('study', 1), ('research', 1)]","[('increase', 1), ('finding', 1)]","[('voice', 1), ('social', 1)]",10.1007/s40122-022-00359-z,"Racial Differences in Pain, Nutrition, and Oxidative Stress"
3982,3,"[('choice', 1), ('social', 1)]","[('the', 14), ('to', 8), ('actor', 7), ('deontological', 6)]","[('suggest', 1), ('test', 1)]",[],"[('social', 1)]",10.1016/j.pmn.2022.02.004,Functional Goals and How Palliative Patients With Cancer Managed Pain
3984,2,"[('label', 1), ('counter', 1)]","[('to', 11), ('diversity', 10), ('in', 8), ('of', 8)]","[('survey', 1), ('study', 1), ('research', 1), ('analysis', 1)]",[],[],10.1007/s40122-022-00359-z,"Racial Differences in Pain, Nutrition, and Oxidative Stress"
3986,3,"[('social', 1), ('experience', 1)]","[('the', 9), ('of', 9), ('intergroup', 7), ('conflict', 5)]","[('research', 1), ('suggest', 1), ('controlled', 1)]",[],"[('social', 1)]",10.1002/acr.24792,Race Differences in Postacute Physical Therapy Utilization and Patient‐Reported Function After Total Knee Arthroplasty
3988,3,"[('design', 1), ('behavior', 1), ('prosocial', 1)]","[('of', 8), ('and', 5), ('big', 4), ('push', 4)]","[('recent', 1), ('research', 1), ('positive', 1), ('regression', 1)]",[],[],10.1002/acr2.11307,Use of Complementary and Alternative Therapy for Knee Osteoarthritis: Race and Gender Variations
3989,8,"[('trump', 1), ('social', 1)]","[('the', 8), ('political', 6), ('and', 6), ('youtube', 4)]","[('analysis', 1), ('study', 1), ('modeling', 1), ('test', 1)]",[],"[('video', 1), ('online', 1), ('social', 1), ('content', 1)]",10.1080/10668926.2019.1565844,An Investigation of Paramedical Vocational Interest and Choice for Latinos and African American Men in Texas Community Colleges
3991,2,"[('human', 1), ('dehumanize', 1)]","[('the', 11), ('in', 8), ('of', 7), ('was', 7)]","[('positive', 1), ('recent', 1), ('study', 1), ('suggest', 1)]",[],[],10.2460/javma.21.10.0459,"Integrating the Multicultural Veterinary Medical Association actionables into diversity, equity, and inclusion curricula in United States veterinary colleges."
3992,2,"[('false', 1), ('bias', 1)]","[('studies', 9), ('the', 7), ('of', 7), ('in', 6)]","[('research', 1), ('overall', 1), ('assessment', 1), ('review', 1)]",[],[],10.1037/pha0000393,Pain Interference and Cognitive Processes of E-Cigarette Use: The Differential Effect of Sex
3993,7,"[('choice', 1), ('media', 1), ('social', 1)]","[('and', 12), ('consumers', 7), ('to', 7), ('“', 6)]","[('survey', 1), ('model', 1), ('analyzed', 1), ('regression', 1)]",[],"[('data', 1), ('media', 1), ('social', 1), ('like', 1)]",10.1186/s13063-021-05841-1,The effect of a Life Care Specialist on pain management and opioid-related outcomes among patients with orthopedic trauma: study protocol for a randomized controlled trial
3995,3,"[('social', 1)]","[('the', 13), ('cooperation', 8), ('of', 7), ('social', 5)]","[('observe', 1), ('negative', 1), ('suggest', 1), ('theoretical', 1)]","[('increase', 1)]","[('social', 1)]",10.1111/ger.12608,Orofacial pain among Chinese older adults in the last year of life
3998,2,"[('social', 1)]","[('in', 11), ('the', 8), ('and', 8), ('knowledge', 7)]","[('study', 1), ('research', 1), ('analyzed', 1)]",[],"[('social', 1)]",10.1007/s40122-022-00359-z,"Racial Differences in Pain, Nutrition, and Oxidative Stress"
3999,6,"[('prosocial', 1), ('user', 1), ('social', 1), ('media', 1)]","[('to', 4), ('social', 4), ('media', 3), ('of', 3)]","[('research', 1), ('positive', 1)]",[],"[('user', 1), ('media', 1), ('social', 1), ('content', 1)]",10.2147/jpr.s327230,Is ABO Blood Group a Predictive Factor for the Amount of Opioid Consumption in the First 24 Hours After Cesarean Section?
4001,4,"[('experience', 1), ('voice', 1), ('design', 1), ('human', 1)]","[('of', 11), ('voice', 9), ('and', 9), ('a', 7)]","[('survey', 1), ('framework', 1), ('analysis', 1)]",[],"[('voice', 1), ('user', 1), ('social', 1), ('conversational', 1)]",10.1007/s40122-022-00359-z,"Racial Differences in Pain, Nutrition, and Oxidative Stress"
4003,6,"[('prosocial', 1), ('user', 1), ('social', 1), ('media', 1)]","[('to', 4), ('social', 4), ('media', 3), ('of', 3)]","[('research', 1), ('positive', 1)]",[],"[('user', 1), ('media', 1), ('social', 1), ('content', 1)]",10.1007/s11606-022-07464-x,Development of a Multicomponent Intervention to Decrease Racial Bias Among Healthcare Staff
4006,7,"[('choice', 1), ('media', 1), ('social', 1)]","[('and', 12), ('consumers', 7), ('to', 7), ('“', 6)]","[('survey', 1), ('model', 1), ('analyzed', 1), ('regression', 1)]",[],"[('data', 1), ('media', 1), ('social', 1), ('like', 1)]",10.1007/s40122-022-00359-z,"Racial Differences in Pain, Nutrition, and Oxidative Stress"
4007,2,"[('human', 1), ('altruism', 1)]","[('of', 7), ('and', 6), ('the', 4), ('that', 4)]",[],[],[],10.1016/j.pmn.2022.01.007,"Patient Race, Ethnicity, Language, and Pain Severity in Primary Care: A Retrospective Electronic Health Record Study"
4009,2,"[('social', 1)]","[('the', 7), ('and', 7), ('of', 6), ('to', 4)]","[('tested', 1), ('research', 1)]",[],"[('social', 1)]",10.1177/09567976211040745,Pain as Social Glue: A Preregistered Direct Replication of Experiment 2 of Bastian et al. (2014)
4010,2,"[('behavior', 1), ('human', 1), ('tolerance', 1), ('social', 1)]","[('the', 23), ('of', 11), ('to', 10), ('we', 8)]","[('difference', 1), ('pattern', 1), ('model', 1), ('impact', 1)]",[],"[('social', 1)]",10.1111/etho.12329,Chronic Pain and the Arcs of Suffering and Well‐Being: A Systems Model of/for Living with Psoriatic Arthritis
4014,3,"[('social', 1)]","[('and', 17), ('the', 16), ('to', 16), ('women', 15)]","[('observe', 1), ('analysis', 1), ('research', 1), ('theoretical', 1)]","[('increase', 1)]","[('social', 1)]",10.2106/jbjs.rvw.21.00161,"Race, Utilization, and Outcomes in Total Hip and Knee Arthroplasty"
4016,3,"[('social', 1)]","[('social', 12), ('norms', 10), ('the', 9), ('smoking', 8)]","[('intervention', 1), ('analysis', 1), ('study', 1), ('analyze', 1)]","[('intervention', 1)]","[('social', 1)]",10.1007/s40122-022-00359-z,"Racial Differences in Pain, Nutrition, and Oxidative Stress"
4017,8,"[('media', 1), ('social', 1), ('users', 1)]","[('social', 16), ('media', 15), ('the', 10), ('of', 9)]","[('positive', 1), ('overall', 1), ('negative', 1)]","[('increase', 1)]","[('online', 1), ('data', 1), ('media', 1), ('social', 1)]",10.1007/s40122-022-00359-z,"Racial Differences in Pain, Nutrition, and Oxidative Stress"
4022,2,"[('social', 1)]","[('the', 7), ('we', 7), ('of', 6), ('to', 6)]","[('found', 1), ('research', 1), ('negative', 1)]",[],"[('social', 1)]",10.1097/acm.0000000000002486,Socially Accountable Academic Health Centers
4025,4,"[('behavior', 1), ('social', 1), ('bias', 1)]","[('and', 9), ('children', 8), ('social', 7), ('the', 5)]","[('framework', 1), ('study', 1), ('research', 1), ('model', 1)]",[],"[('social', 1)]",10.1037/cdp0000513,Children’s Cross-Cultural Categorizations of Racially Ambiguous Faces in Taiwan and the U.S.
