,wordscore,most_freq_target_words,most_freq_all_words,study_design_hunch,impact_of_study_hunch,tech_words_freq,_doi,_title
0,4,"[('behavior', 1), ('human', 1)]","[('to', 11), ('of', 10), ('the', 9), ('be', 7)]","[('meta-analysis', 1), ('found', 1), ('measure', 1), ('conventional', 1)]","[('finding', 1)]","[('data', 1)]",10.1016/j.cresp.2022.100035,On the habitual nature of environmentally relevant behavior: Evidence from a consequential dilemma task
1,2,"[('social', 1)]","[('the', 13), ('and', 11), ('of', 9), ('social', 8)]","[('intervention', 1), ('articles', 1), ('positive', 1), ('review', 1)]","[('increase', 1), ('intervention', 1)]","[('virtual', 1), ('social', 1)]",10.32328/turkjforsci.953712,A STUDY ON OFFICE PAPER PRODUCTION FROM PRIMARY AND SECONDARY FIBERS
5,2,"[('design', 1), ('experience', 1)]","[('the', 17), ('a', 11), ('is', 9), ('cbdbe', 8)]","[('study', 1)]",[],[],10.1002/eet.1981,Why do citizens engage in climate action? A comprehensive framework of individual conditions and a proposed research approach
9,2,"[('rated', 1), ('information', 1)]","[('the', 20), ('energy', 15), ('in', 8), ('to', 8)]","[('study', 1), ('modeling', 1), ('difference', 1), ('model', 1)]",[],[],10.1016/j.erss.2022.102496,Double trouble: Concurrently targeting water and electricity using normative messages in the Middle East
12,5,"[('architecture', 1), ('choice', 1), ('nudge', 1), ('social', 1)]","[('the', 10), ('to', 9), ('in', 6), ('‘', 5)]","[('study', 1)]",[],"[('social', 1)]",10.3390/su14031427,"Insights into Efficient Irrigation of Urban Landscapes: Analysis Using Remote Sensing, Parcel Data, Water Use, and Tiered Rates"
14,3,"[('design', 1), ('consumer', 1)]","[('to', 12), ('that', 7), ('a', 6), ('the', 6)]","[('tested', 1)]",[],"[('reach', 1)]",10.1007/978-3-030-14449-4_1-1,Seminal Articles in Social Marketing
17,3,"[('behavior', 1), ('social', 1)]","[('the', 8), ('of', 7), ('in', 6), ('a', 6)]","[('analysis', 1), ('recent', 1), ('field', 1), ('review', 1)]",[],"[('social', 1)]",10.1080/1360080x.2022.2027611,Greening on-campus housing: blending commercial and higher education contexts
18,3,"[('behavior', 1), ('social', 1)]","[('the', 8), ('of', 7), ('in', 6), ('a', 6)]","[('analysis', 1), ('recent', 1), ('field', 1), ('review', 1)]",[],"[('social', 1)]",10.1016/j.jenvp.2021.101625,"Pay now, save later: Using insights from behavioural economics to commit consumers to environmental sustainability"
19,3,"[('behavior', 1), ('social', 1)]","[('the', 8), ('of', 7), ('in', 6), ('a', 6)]","[('analysis', 1), ('recent', 1), ('field', 1), ('review', 1)]",[],"[('social', 1)]",10.1007/s10668-021-01540-8,The effect of message framing and language intensity on green consumption behavior willingness
20,4,"[('behavior', 1)]","[('to', 10), ('meat', 9), ('and', 7), ('participants', 7)]","[('control', 1), ('overall', 1)]","[('increase', 1), ('decrease', 1)]","[('data', 1)]",10.1016/j.jenvp.2021.101669,Aesthetics and logistics in urban parks; can moving waste receptacles to park exits decrease littering?
21,3,"[('behavior', 1), ('social', 1)]","[('the', 8), ('of', 7), ('in', 6), ('a', 6)]","[('analysis', 1), ('recent', 1), ('field', 1), ('review', 1)]",[],"[('social', 1)]",10.1007/s42822-020-00043-x,Going Green: A Systematic Review of Proenvironmental Empirical Research in Behavior Analysis
22,4,"[('behavior', 1)]","[('to', 11), ('and', 8), ('environmental', 7), ('the', 7)]","[('subjects', 1), ('intervention', 1), ('survey', 1), ('study', 1)]","[('intervention', 1)]","[('online', 1), ('content', 1)]",10.1007/s42822-020-00043-x,Going Green: A Systematic Review of Proenvironmental Empirical Research in Behavior Analysis
23,3,"[('design', 1), ('consumer', 1), ('human', 1)]","[('and', 14), ('the', 13), ('of', 9), ('in', 5)]","[('overall', 1), ('recent', 1), ('analysis', 1), ('research', 1)]",[],[],10.1007/s42822-020-00043-x,Going Green: A Systematic Review of Proenvironmental Empirical Research in Behavior Analysis
25,2,"[('behavior', 1), ('human', 1)]","[('and', 6), ('in', 5), ('of', 4), ('as', 3)]","[('research', 1), ('positive', 1), ('review', 1)]",[],[],10.1016/j.appet.2021.105726,Monitoring a meat-free pledge with smartphones: An experimental study
27,3,"[('behavior', 1), ('boost', 1)]","[('and', 6), ('in', 6), ('technologies', 4), ('to', 4)]","[('research', 1), ('impact', 1)]",[],"[('digital', 1)]",10.3390/su14042025,Speaking Their Language: Does Environmental Signage Align to Personal Dimensions of Environmentally Responsible Behavior in Undergraduate Residence Halls?
28,3,"[('behavior', 1), ('social', 1)]","[('the', 8), ('of', 7), ('in', 6), ('a', 6)]","[('analysis', 1), ('recent', 1), ('field', 1), ('review', 1)]",[],"[('social', 1)]",10.1016/j.jenvman.2021.114160,Recycling behaviour: Mapping knowledge domain through bibliometrics and text mining
29,5,"[('design', 1), ('social', 1), ('trust', 1)]","[('and', 5), ('behaviors', 5), ('social', 4), ('pro-environmental', 4)]","[('meta-analysis', 1), ('suggest', 1)]",[],"[('like', 1), ('social', 1)]",10.1016/j.resconrec.2021.105808,Could visual cues moderate the normative influence in promoting energy conservation? A perspective from the construal level
30,2,"[('social', 1)]","[('the', 10), ('a', 8), ('and', 7), ('to', 6)]",[],[],"[('social', 1)]",10.1016/j.erss.2021.101958,Positive reinforcement is just the beginning: Associative learning principles for energy efficiency and climate sustainability
33,5,"[('design', 1), ('architecture', 1), ('information', 1)]","[('the', 7), ('to', 6), ('feedback', 6), ('drivers', 5)]","[('field', 1), ('study', 1), ('research', 1), ('suggest', 1)]","[('decrease', 1)]","[('recommendation', 1)]",10.1007/s42822-020-00043-x,Going Green: A Systematic Review of Proenvironmental Empirical Research in Behavior Analysis
35,3,"[('information', 1)]","[('of', 10), ('to', 7), ('the', 6), ('energy', 6)]","[('outline', 1), ('review', 1)]",[],"[('reach', 1), ('like', 1)]",10.3390/su132011349,Collective Public Commitment: Young People on the Path to a More Sustainable Lifestyle
36,2,"[('design', 1)]","[('of', 8), ('and', 5), ('suggestive', 4), ('selling', 4)]","[('research', 1), ('positive', 1), ('impact', 1), ('theoretical', 1)]",[],"[('data', 1)]",10.1007/978-981-16-4230-2_52,Integrated Strategy of Plastic Waste Management to Green Environmental Sustainability and Health Care
39,2,"[('behavior', 1)]","[('to', 5), ('’', 3), ('the', 3), ('consumers', 2)]","[('intervention', 1)]","[('intervention', 1)]",[],10.1016/j.rtbm.2020.100549,"Walkability, accessibility to metro stations and retail location choice: Some evidence from the case study of Naples"
41,7,"[('behavior', 1), ('attitudinal', 1), ('information', 1), ('social', 1)]","[('of', 9), ('and', 9), ('the', 8), ('a', 8)]","[('propose', 1), ('questionnaire', 1), ('framework', 1), ('modeling', 1)]",[],"[('data', 1), ('social', 1)]",10.1080/15534510.2022.2047776,Self-persuading norms: Adding a self-persuasion technique strengthens the influence of descriptive social norms
44,2,"[('users', 1)]","[('the', 20), ('in', 10), ('of', 8), ('energy', 8)]","[('propose', 1), ('recent', 1), ('test', 1), ('survey', 1)]","[('increase', 1)]",[],10.1016/j.jeem.2021.102539,Choose to reuse! The effect of action-close reminders on pro-environmental behavior
45,3,"[('behavior', 1)]","[('the', 7), ('of', 7), ('behavior', 6), ('and', 4)]","[('intervention', 1), ('follow-up', 1), ('analysis', 1), ('article', 1)]","[('increase', 1), ('intervention', 1)]",[],10.1080/1360080x.2022.2027611,Greening on-campus housing: blending commercial and higher education contexts
61,3,"[('behavior', 1), ('prosocial', 1), ('altruism', 1)]","[('of', 9), ('the', 6), ('motives', 4), ('and', 4)]","[('analysis', 1)]",[],[],10.1037/pspi0000389,Cross-Cultural Variation in Cooperation: A Meta-Analysis
63,2,"[('human', 1)]","[('the', 14), ('of', 8), ('cooperation', 6), ('and', 5)]","[('theoretical', 1), ('positive', 1)]","[('finding', 1)]",[],10.1037/pspi0000389,Cross-Cultural Variation in Cooperation: A Meta-Analysis
72,2,[],"[('the', 15), ('that', 11), ('to', 11), ('of', 8)]","[('propose', 1), ('research', 1), ('suggest', 1)]","[('finding', 1)]","[('reach', 1)]",10.1016/j.amc.2022.127069,"Effects of interconnections among corruption, institutional punishment, and economic factors on the evolution of cooperation"
78,3,"[('altruism', 1)]","[('the', 12), ('of', 9), ('a', 8), ('contest', 7)]","[('article', 1)]","[('increase', 1), ('decrease', 1)]",[],10.1037/dec0000178,Unpacking the Black Box: How Inter- and Intra-Team Forces Motivate Team Rationality
85,2,"[('social', 1)]","[('the', 17), ('to', 7), ('and', 7), ('of', 7)]","[('control', 1), ('propose', 1), ('observe', 1), ('impact', 1)]",[],"[('social', 1)]",10.1016/j.physa.2022.126972,Asymmetric games on networks: Towards an Ising-model representation
87,3,"[('information', 1)]","[('the', 7), ('a', 6), ('we', 5), ('of', 5)]","[('model', 1)]","[('increase', 1), ('decrease', 1)]",[],10.1016/j.jebo.2021.05.017,The evolutionary stability of in-group altruism in productive and destructive group contests
90,2,"[('social', 1)]","[('to', 8), ('the', 8), ('’', 7), ('and', 6)]","[('experiment', 1), ('research', 1), ('subjects', 1)]",[],"[('social', 1)]",10.3389/fpsyg.2022.800701,Incidental Emotions and Cooperation in a Public Goods Game
91,6,"[('behavior', 1), ('architecture', 1), ('human', 1), ('social', 1)]","[('conflict', 8), ('intergroup', 7), ('the', 6), ('as', 6)]","[('propose', 1), ('found', 1), ('research', 1)]",[],"[('social', 1)]",10.1037/pspi0000389,Cross-Cultural Variation in Cooperation: A Meta-Analysis
92,4,"[('information', 1), ('social', 1)]","[('of', 13), ('the', 9), ('threshold', 7), ('and', 6)]","[('experiment', 1), ('framework', 1), ('impact', 1), ('tested', 1)]","[('increase', 1)]","[('social', 1)]",10.1007/978-3-030-91532-2_6,Finally Back to Campus? Motivations for Facemask Adoption in the Higher Education Sector
93,2,"[('choice', 1), ('fake', 1)]","[('inauthenticity', 7), ('to', 7), ('and', 7), ('the', 6)]","[('control', 1), ('study', 1), ('research', 1), ('positive', 1)]",[],[],10.1037/pspi0000389,Cross-Cultural Variation in Cooperation: A Meta-Analysis
96,5,"[('design', 1), ('behavior', 1), ('nudge', 1), ('social', 1)]","[('the', 12), ('to', 7), ('in', 6), ('a', 5)]","[('subjects', 1), ('experiment', 1), ('overall', 1), ('study', 1)]",[],"[('social', 1)]",10.1016/j.geb.2022.02.008,Communication and cooperation in Prisoner&#x27;s Dilemma games
97,2,"[('social', 1)]","[('the', 7), ('and', 7), ('of', 6), ('to', 4)]","[('tested', 1), ('research', 1)]",[],"[('social', 1)]",10.1080/10413200.2021.2021564,Effects of a multifaceted team goal-setting intervention for youth volleyball teams
98,5,"[('design', 1), ('behavior', 1), ('nudge', 1), ('social', 1)]","[('the', 12), ('to', 7), ('in', 6), ('a', 5)]","[('subjects', 1), ('experiment', 1), ('overall', 1), ('study', 1)]",[],"[('social', 1)]",10.1177/00027642211066024,Theoretical Notes on Action Schemes in Society
100,2,"[('disinformation', 1)]","[('of', 4), ('and', 3), ('are', 3), ('the', 3)]",[],[],"[('video', 1)]",10.1007/s11211-021-00379-8,Framing Perceptions of Justice in a Public Goods Dilemma
101,4,"[('media', 1), ('social', 1)]","[('the', 14), ('and', 7), ('by', 6), ('we', 6)]","[('observe', 1), ('model', 1), ('field', 1)]",[],"[('media', 1), ('social', 1)]",10.1016/j.obhdp.2021.104105,The power of defaults in intergroup conflict
103,2,"[('behavior', 1), ('users', 1)]","[('the', 23), ('of', 13), ('and', 10), ('power', 6)]","[('analysis', 1), ('model', 1), ('analyzed', 1)]",[],[],10.1002/mar.21643,Fake smiles. Customer reactions to employees’ display inauthenticity and choice restrictions
105,6,"[('news', 1), ('misinformation', 1), ('disinformation', 1), ('fake', 1)]","[('the', 15), ('news', 10), ('fake', 7), ('energy', 7)]","[('found', 1), ('detection', 1)]",[],"[('web', 1), ('data', 1)]",10.1037/pspi0000389,Cross-Cultural Variation in Cooperation: A Meta-Analysis
106,10,"[('behavior', 1), ('information', 1), ('user', 1), ('users', 1)]","[('of', 6), ('to', 6), ('the', 5), ('a', 5)]","[('analyze', 1), ('research', 1), ('result', 1)]","[('increase', 1)]","[('web', 1), ('websites', 1), ('data', 1), ('user', 1)]",10.1016/j.socec.2022.101848,Pledges and how social influence shapes their effectiveness
107,12,"[('fake', 1), ('true', 1), ('design', 1), ('information', 1)]","[('the', 11), ('detection', 8), ('and', 7), ('to', 5)]","[('detection', 1), ('overall', 1), ('model', 1)]",[],"[('algorithm', 1), ('data', 1), ('media', 1), ('social', 1)]",10.1177/09567976211031215,"Evaluating Benefits, Costs, and Social Value as Predictors of Gratitude."
108,6,"[('news', 1), ('misinformation', 1), ('disinformation', 1), ('fake', 1)]","[('the', 15), ('news', 10), ('fake', 7), ('energy', 7)]","[('found', 1), ('detection', 1)]",[],"[('web', 1), ('data', 1)]",10.1016/j.socec.2022.101848,Pledges and how social influence shapes their effectiveness
109,12,"[('information', 1), ('user', 1), ('social', 1), ('users', 1)]","[('the', 28), ('of', 9), ('and', 8), ('“', 7)]","[('propose', 1), ('observe', 1), ('framework', 1), ('result', 1)]",[],"[('twitter', 1), ('content', 1), ('recommendation', 1), ('data', 1)]",10.1016/j.evolhumbehav.2021.12.003,Common knowledge promotes cooperation in the threshold public goods game by reducing uncertainty
110,7,"[('trust', 1), ('information', 1), ('social', 1), ('users', 1)]","[('to', 12), ('the', 9), ('a', 8), ('clickbait', 7)]","[('study', 1), ('research', 1), ('model', 1), ('detection', 1)]",[],"[('channels', 1), ('online', 1), ('content', 1), ('social', 1)]",10.1073/pnas.2120481119,AI-synthesized faces are indistinguishable from real faces and more trustworthy
111,5,"[('rumor', 1), ('design', 1), ('information', 1), ('user', 1)]","[('the', 11), ('and', 8), ('of', 7), ('to', 7)]","[('propose', 1), ('predictions', 1), ('study', 1), ('model', 1)]",[],"[('data', 1), ('content', 1), ('user', 1)]",10.1016/j.physa.2022.127075,The effect of media on opinion formation
112,3,"[('design', 1)]","[('spatial', 12), ('the', 11), ('of', 7), ('link', 6)]","[('propose', 1), ('model', 1), ('conventional', 1), ('semantic', 1)]",[],"[('web', 1), ('data', 1)]",10.1007/s10115-021-01610-3,Word and graph attention networks for semi-supervised classification
113,10,"[('fake', 1), ('bias', 1), ('social', 1), ('users', 1)]","[('the', 9), ('of', 8), ('and', 7), ('news', 5)]","[('negative', 1), ('test', 1), ('research', 1), ('theoretical', 1)]",[],"[('online', 1), ('media', 1), ('social', 1), ('twitter', 1)]",10.1016/j.ijepes.2022.108058,Cascading failure in coupled networks of transportation and power grid
114,4,"[('media', 1), ('social', 1)]","[('the', 14), ('and', 7), ('by', 6), ('we', 6)]","[('observe', 1), ('model', 1), ('field', 1)]",[],"[('media', 1), ('social', 1)]",10.1145/3477050,Unsupervised Adversarial Network Alignment with Reinforcement Learning
115,6,"[('news', 1), ('misinformation', 1), ('disinformation', 1), ('fake', 1)]","[('the', 15), ('news', 10), ('fake', 7), ('energy', 7)]","[('found', 1), ('detection', 1)]",[],"[('web', 1), ('data', 1)]",10.1016/j.datak.2022.101985,FaNDS: Fake News Detection System using energy flow
116,10,"[('fake', 1), ('bias', 1), ('social', 1), ('users', 1)]","[('the', 9), ('of', 8), ('and', 7), ('news', 5)]","[('negative', 1), ('test', 1), ('research', 1), ('theoretical', 1)]",[],"[('online', 1), ('media', 1), ('social', 1), ('twitter', 1)]",10.1145/3488560.3501395,"Fact-Checking, Fake News, Propaganda, Media Bias, and the COVID-19 Infodemic"
117,4,"[('consumer', 1)]","[('the', 12), ('to', 6), ('and', 6), ('of', 6)]","[('analysis', 1), ('research', 1), ('theoretical', 1)]","[('finding', 1)]","[('digital', 1), ('data', 1)]",10.1145/3473343,How Do Home Computer Users Browse the Web?
118,9,"[('user', 1), ('social', 1)]","[('on', 5), ('data', 4), ('and', 4), ('the', 4)]","[('survey', 1), ('study', 1), ('detection', 1), ('model', 1)]",[],"[('twitter', 1), ('online', 1), ('facebook', 1), ('digital', 1)]",10.1145/3523060,Dynamic Probabilistic Graphical Model for Progressive Fake News Detection on Social Media Platform
120,8,"[('misinformation', 1), ('disinformation', 1), ('fake', 1), ('news', 1)]","[('and', 9), ('the', 9), ('misperceptions', 9), ('ine', 8)]","[('survey', 1), ('research', 1), ('model', 1), ('impact', 1)]",[],"[('data', 1), ('media', 1), ('social', 1)]",10.1007/s11280-022-01031-4,SSLE: A framework for evaluating the “Filter Bubble” effect on the news aggregator and recommenders
121,7,"[('false', 1), ('media', 1), ('social', 1), ('rumor', 1)]","[('the', 14), ('a', 11), ('that', 11), ('of', 8)]","[('analysis', 1), ('study', 1), ('model', 1)]",[],"[('online', 1), ('media', 1), ('social', 1)]",10.1007/s11280-022-01032-3,Leverage knowledge graph and GCN for fine-grained-level clickbait detection
122,2,"[('information', 1), ('accuracy', 1)]","[('and', 10), ('of', 8), ('the', 8), ('to', 8)]","[('control', 1), ('detection', 1), ('mean', 1), ('analysed', 1)]",[],[],10.1016/j.ins.2022.01.036,MGAT-ESM: Multi-channel graph attention neural network with event-sharing module for rumor detection
123,10,"[('fake', 1), ('bias', 1), ('social', 1), ('users', 1)]","[('the', 9), ('of', 8), ('and', 7), ('news', 5)]","[('negative', 1), ('test', 1), ('research', 1), ('theoretical', 1)]",[],"[('online', 1), ('media', 1), ('social', 1), ('twitter', 1)]",10.1007/s10115-021-01603-2,DORIC: discovering topological relations based on spatial link composition
124,10,"[('fake', 1), ('bias', 1), ('social', 1), ('users', 1)]","[('the', 9), ('of', 8), ('and', 7), ('news', 5)]","[('negative', 1), ('test', 1), ('research', 1), ('theoretical', 1)]",[],"[('online', 1), ('media', 1), ('social', 1), ('twitter', 1)]",10.1016/j.segan.2022.100689,WAMS-based two-level robust detection methodology of power system events
125,14,"[('reddit', 1), ('true', 1), ('false', 1), ('information', 1)]","[('the', 14), ('and', 8), ('in', 7), ('that', 6)]","[('propose', 1), ('framework', 1), ('call', 1), ('semantic', 1)]",[],"[('algorithm', 1), ('reddit', 1), ('twitter', 1), ('data', 1)]",10.1016/j.ijinfomgt.2022.102474,Quantifying the impacts of online fake news on the equity value of social media platforms – Evidence from Twitter
126,7,"[('false', 1), ('media', 1), ('social', 1), ('rumor', 1)]","[('the', 14), ('a', 11), ('that', 11), ('of', 8)]","[('analysis', 1), ('study', 1), ('model', 1)]",[],"[('online', 1), ('media', 1), ('social', 1)]",10.1016/j.physa.2022.127075,The effect of media on opinion formation
127,7,"[('false', 1), ('media', 1), ('social', 1), ('rumor', 1)]","[('the', 14), ('a', 11), ('that', 11), ('of', 8)]","[('analysis', 1), ('study', 1), ('model', 1)]",[],"[('online', 1), ('media', 1), ('social', 1)]",10.1016/j.datak.2022.101985,FaNDS: Fake News Detection System using energy flow
128,3,"[('accuracy', 1)]","[('the', 33), ('of', 21), ('and', 12), ('to', 10)]","[('study', 1), ('model', 1), ('test', 1), ('impact', 1)]","[('increase', 1)]","[('content', 1)]",10.1016/j.ijinfomgt.2022.102474,Quantifying the impacts of online fake news on the equity value of social media platforms – Evidence from Twitter
129,10,"[('fake', 1), ('bias', 1), ('social', 1), ('users', 1)]","[('the', 9), ('of', 8), ('and', 7), ('news', 5)]","[('negative', 1), ('test', 1), ('research', 1), ('theoretical', 1)]",[],"[('online', 1), ('media', 1), ('social', 1), ('twitter', 1)]",10.4018/jgim.290364,Consumer Engagement Through Conditional Promotions
131,10,"[('fake', 1), ('bias', 1), ('social', 1), ('users', 1)]","[('the', 9), ('of', 8), ('and', 7), ('news', 5)]","[('negative', 1), ('test', 1), ('research', 1), ('theoretical', 1)]",[],"[('online', 1), ('media', 1), ('social', 1), ('twitter', 1)]",10.2200/s00926ed1v01y201906dmk018,Detecting Fake News on Social Media
132,6,"[('amplification', 1), ('information', 1), ('social', 1), ('users', 1)]","[('de', 14), ('the', 7), ('las', 6), ('redes', 6)]","[('study', 1), ('impact', 1)]",[],"[('data', 1), ('media', 1), ('social', 1), ('twitter', 1)]",10.1016/j.childyouth.2022.106440,A qualitative exploration of how young men in the UK perceive and experience informal help-seeking for mental health difficulties
133,11,"[('news', 1), ('information', 1), ('social', 1), ('media', 1)]","[('the', 33), ('of', 15), ('and', 11), ('to', 9)]","[('articles', 1), ('field', 1), ('overall', 1), ('recent', 1)]",[],"[('algorithm', 1), ('online', 1), ('content', 1), ('social', 1)]",10.1016/j.chb.2021.107173,Incidental news exposure and COVID-19 misperceptions: A moderated-mediation model
134,7,"[('information', 1), ('social', 1), ('accuracy', 1), ('trust', 1)]","[('the', 14), ('of', 7), ('algorithm', 6), ('to', 5)]","[('detection', 1)]",[],"[('algorithm', 1), ('privacy', 1), ('social', 1)]",10.1016/j.eswa.2022.116688,Preventing rumor spread with deep learning
135,11,"[('misinformation', 1), ('fake', 1), ('false', 1), ('information', 1)]","[('and', 10), ('news', 9), ('fake', 8), ('the', 7)]","[('study', 1), ('research', 1), ('impact', 1), ('detection', 1)]",[],"[('online', 1), ('data', 1), ('social', 1), ('user', 1)]",10.1016/j.atech.2021.100030,Evaluation of cameras and image distance for CNN-based weed detection in wild blueberry
137,6,"[('news', 1), ('misinformation', 1), ('disinformation', 1), ('fake', 1)]","[('the', 15), ('news', 10), ('fake', 7), ('energy', 7)]","[('found', 1), ('detection', 1)]",[],"[('web', 1), ('data', 1)]",10.1016/j.ijinfomgt.2022.102474,Quantifying the impacts of online fake news on the equity value of social media platforms – Evidence from Twitter
138,11,"[('misinformation', 1), ('disinformation', 1), ('fake', 1), ('counter', 1)]","[('the', 19), ('of', 12), ('and', 11), ('in', 11)]","[('analysis', 1), ('study', 1), ('research', 1), ('field', 1)]",[],"[('web', 1), ('content', 1), ('data', 1), ('digital', 1)]",10.1145/3485047,SenseLens: An Efficient Social Signal Conditioning System for True Event Detection
139,7,"[('information', 1), ('media', 1), ('social', 1), ('users', 1)]","[('the', 8), ('on', 7), ('and', 7), ('social', 5)]","[('found', 1), ('meta-analysis', 1), ('study', 1), ('impact', 1)]",[],"[('media', 1), ('social', 1), ('content', 1)]",10.1016/j.eswa.2022.116688,Preventing rumor spread with deep learning
140,2,"[('information', 1)]","[('the', 12), ('of', 7), ('details', 5), ('a', 5)]","[('control', 1), ('field', 1), ('study', 1), ('interviewed', 1)]","[('increase', 1)]",[],10.1016/j.eswa.2022.116688,Preventing rumor spread with deep learning
141,6,"[('design', 1), ('social', 1), ('users', 1)]","[('de', 19), ('the', 18), ('of', 11), ('social', 10)]","[('modeling', 1), ('result', 1), ('analysis', 1), ('analyze', 1)]","[('increase', 1)]","[('web', 1), ('twitter', 1), ('digital', 1), ('data', 1)]",10.1016/j.ecoinf.2022.101608,Enhanced understanding of physicochemical constraints on Corbicula japonica habitat in Lake Shinji assisted by machine learning
142,10,"[('fake', 1), ('bias', 1), ('social', 1), ('users', 1)]","[('the', 9), ('of', 8), ('and', 7), ('news', 5)]","[('negative', 1), ('test', 1), ('research', 1), ('theoretical', 1)]",[],"[('online', 1), ('media', 1), ('social', 1), ('twitter', 1)]",10.1016/j.ijinfomgt.2022.102474,Quantifying the impacts of online fake news on the equity value of social media platforms – Evidence from Twitter
143,7,"[('false', 1), ('media', 1), ('social', 1), ('rumor', 1)]","[('the', 14), ('a', 11), ('that', 11), ('of', 8)]","[('analysis', 1), ('study', 1), ('model', 1)]",[],"[('online', 1), ('media', 1), ('social', 1)]",10.1145/3491203,A Self-Supervised Representation Learning of Sentence Structure for Authorship Attribution
144,10,"[('fake', 1), ('bias', 1), ('social', 1), ('users', 1)]","[('the', 9), ('of', 8), ('and', 7), ('news', 5)]","[('negative', 1), ('test', 1), ('research', 1), ('theoretical', 1)]",[],"[('online', 1), ('media', 1), ('social', 1), ('twitter', 1)]",10.1016/j.ijinfomgt.2022.102474,Quantifying the impacts of online fake news on the equity value of social media platforms – Evidence from Twitter
145,6,"[('news', 1), ('misinformation', 1), ('disinformation', 1), ('fake', 1)]","[('the', 15), ('news', 10), ('fake', 7), ('energy', 7)]","[('found', 1), ('detection', 1)]",[],"[('web', 1), ('data', 1)]",10.1002/poi3.295,Super‐amplifiers! The role of Twitter extended party networks in political elections
146,5,"[('information', 1)]","[('and', 13), ('the', 11), ('of', 10), ('information', 6)]","[('outline', 1), ('field', 1), ('article', 1), ('research', 1)]",[],"[('online', 1), ('digital', 1), ('reach', 1), ('content', 1)]",10.1016/j.eswa.2022.116635,DSS: A hybrid deep model for fake news detection using propagation tree and stance network
147,6,"[('news', 1), ('misinformation', 1), ('disinformation', 1), ('fake', 1)]","[('the', 15), ('news', 10), ('fake', 7), ('energy', 7)]","[('found', 1), ('detection', 1)]",[],"[('web', 1), ('data', 1)]",10.1016/j.ijhcs.2022.102790,A framework and serious game for decision making in stressful situations; a fire evacuation scenario
149,2,"[('trust', 1)]","[('financial', 8), ('of', 8), ('and', 8), ('nudges', 6)]","[('experiment', 1), ('impact', 1)]",[],"[('online', 1)]",10.1016/j.techsoc.2022.101930,"People lie, actions Don&#x27;t! Modeling infodemic proliferation predictors among social media users"
152,2,[],"[('the', 7), ('and', 6), ('lower', 6), ('are', 5)]","[('survey', 1), ('article', 1)]","[('increase', 1)]","[('data', 1)]",10.1108/gkmc-11-2021-0177,Bibliometric analysis of fake news indexed in Web of Science and Scopus (2001-2020)
156,2,"[('social', 1)]","[('the', 8), ('torture', 7), ('of', 7), ('to', 5)]",[],[],"[('social', 1)]",10.1016/j.ijinfomgt.2022.102474,Quantifying the impacts of online fake news on the equity value of social media platforms – Evidence from Twitter
157,2,"[('behavior', 1), ('nudge', 1)]","[('of', 6), ('nudges', 6), ('and', 6), ('for', 5)]","[('experiment', 1), ('recent', 1), ('test', 1), ('survey', 1)]",[],[],10.1016/j.eswa.2022.116688,Preventing rumor spread with deep learning
