,wordscore,most_freq_target_words,most_freq_all_words,study_design_hunch,impact_of_study_hunch,tech_words_freq,_doi,_title
2533,8,"[('media', 1), ('information', 1), ('social', 1), ('users', 1)]","[('group', 10), ('awareness', 8), ('the', 8), ('emotional', 7)]","[('control', 1), ('experiment', 1), ('positive', 1), ('test', 1)]",[],"[('online', 1), ('media', 1), ('social', 1), ('content', 1)]",10.1016/j.obhdp.2021.04.001,Perceptions of conflict: Parochial cooperation and outgroup spite revisited
2541,3,"[('media', 1), ('social', 1)]","[('the', 14), ('and', 9), ('of', 9), ('social', 6)]","[('modeling', 1), ('positive', 1), ('study', 1), ('research', 1)]",[],"[('community', 1), ('data', 1), ('media', 1), ('social', 1)]",10.1007/s11356-022-19628-7,Evaluating the social outcomes of COVID-19 pandemic: empirical evidence from Pakistan
2542,2,"[('social', 1)]","[('the', 10), ('to', 8), ('csi', 6), ('and', 6)]","[('analysis', 1), ('study', 1), ('research', 1), ('model', 1)]",[],"[('social', 1)]",10.1016/j.jesp.2021.104250,"“We built it” in the past, but “let&#x27;s build it together” in the future: The roles of temporal framing and social justice orientation in shaping attributions for personal success"
2543,3,"[('social', 1)]","[('the', 16), ('de', 14), ('la', 11), ('of', 9)]","[('negative', 1), ('analyzed', 1)]",[],"[('data', 1), ('social', 1)]",10.5465/amj.2017.0245,The Voice Bystander Effect: How Information Redundancy Inhibits Employee Voice
2547,4,"[('media', 1), ('social', 1)]","[('the', 14), ('and', 7), ('by', 6), ('we', 6)]","[('observe', 1), ('model', 1), ('field', 1)]",[],"[('media', 1), ('social', 1)]",10.1016/j.cognition.2021.104770,"“False positive” emotions, responsibility, and moral character"
2553,2,"[('media', 1), ('social', 1), ('users', 1)]","[('of', 10), ('media', 10), ('social', 8), ('the', 6)]","[('measure', 1), ('framework', 1), ('study', 1)]",[],"[('media', 1), ('social', 1)]",10.1016/j.appdev.2021.101356,Interactive effects of coping strategies and emotion dysregulation on risk for peer victimization
2557,2,"[('social', 1)]","[('knowledge', 10), ('of', 10), ('the', 6), ('and', 5)]","[('suggest', 1), ('assessment', 1)]",[],"[('social', 1)]",10.1016/j.chb.2020.106655,Online sexist meme and its effects on moral and emotional processes in social media
2558,3,"[('social', 1)]","[('narcissism', 6), ('to', 5), ('and', 5), ('the', 5)]","[('study', 1), ('theoretical', 1), ('test', 1)]",[],"[('online', 1), ('social', 1)]",10.1177/2633002420904267,Radicalization as cause and consequence of violence in genocides and mass killings
2559,3,"[('choice', 1), ('true', 1)]","[('avatars', 7), ('to', 7), ('for', 6), ('in', 5)]","[('propose', 1)]",[],"[('virtual', 1)]",10.3389/fpsyg.2020.558069,Does It Matter What I Say? Using Language to Examine Reactions to Ostracism as It Occurs
2560,5,"[('consumer', 1)]","[('the', 12), ('of', 8), ('and', 8), ('on', 5)]","[('negative', 1), ('test', 1), ('analysis', 1), ('study', 1)]",[],"[('online', 1), ('data', 1), ('content', 1), ('youtube', 1)]",10.1016/j.chb.2021.107146,"Exploring the roles of online moral disengagement, body esteem, and psychosexual variables in predicting sexting motivations and behaviours"
2566,3,"[('design', 1), ('bias', 1)]","[('in', 8), ('hindsight', 6), ('bias', 6), ('children', 6)]","[('experiment', 1), ('research', 1), ('found', 1), ('pattern', 1)]","[('increase', 1)]",[],10.1002/asi.24637,The emerging science of content labeling: Contextualizing social media content moderation
2567,3,"[('social', 1)]","[('narcissism', 6), ('to', 5), ('and', 5), ('the', 5)]","[('study', 1), ('theoretical', 1), ('test', 1)]",[],"[('online', 1), ('social', 1)]",10.1016/j.marpol.2022.105022,Responsible practice of recreational spearfishing is needed. A Response to Sbragaglia et al. (2021)
2569,2,"[('choice', 1), ('consumer', 1)]","[('the', 8), ('in', 5), ('of', 4), ('options', 4)]","[('research', 1), ('overall', 1)]",[],[],10.1080/15205436.2022.2048027,Developing A Model of News Literacy in Early Adolescents: A Survey Study
2570,4,"[('prosocial', 1), ('behavior', 1), ('social', 1)]","[('of', 13), ('in', 13), ('teasing', 11), ('and', 11)]","[('found', 1), ('positive', 1), ('impact', 1), ('study', 1)]",[],"[('social', 1)]",10.1016/j.eswa.2022.116635,DSS: A hybrid deep model for fake news detection using propagation tree and stance network
2572,5,"[('information', 1), ('social', 1), ('experience', 1)]","[('people', 8), ('a', 7), ('to', 7), ('options', 6)]","[('found', 1), ('research', 1), ('study', 1)]",[],"[('content', 1), ('social', 1)]",10.1016/j.techfore.2022.121607,Revisiting the development trajectory of the digital divide: A main path analysis approach
2573,4,"[('false', 1), ('user', 1), ('users', 1)]","[('the', 17), ('die', 10), ('of', 9), ('und', 6)]","[('control', 1), ('study', 1), ('detection', 1), ('negative', 1)]","[('increase', 1)]","[('data', 1), ('profile', 1), ('user', 1)]",10.3389/fnagi.2021.746236,The “Neural Shift” of Sleep Quality and Cognitive Aging: A Resting-State MEG Study of Transient Neural Dynamics
2576,18,"[('headline', 1), ('user', 1), ('social', 1), ('users', 1)]","[('news', 29), ('and', 21), ('the', 17), ('on', 17)]","[('negative', 1), ('overall', 1), ('positive', 1), ('test', 1)]","[('increase', 1), ('decrease', 1)]","[('websites', 1), ('twitter', 1), ('online', 1), ('content', 1)]",10.1145/3501401,Arabic Fake News Detection: A Fact Checking Based Deep Learning Approach
2580,3,"[('prosocial', 1), ('information', 1)]","[('in', 12), ('of', 11), ('synchrony', 10), ('and', 10)]","[('series', 1), ('found', 1)]","[('increase', 1)]",[],10.1016/j.chb.2021.107121,"Testing the cognitive involvement hypothesis on social media: &#x27;News finds me&#x27; perceptions, partisanship, and fake news credibility"
2582,2,"[('behavior', 1), ('information', 1)]","[('in', 11), ('the', 10), ('and', 9), ('buyer–seller', 8)]","[('review', 1), ('research', 1), ('call', 1), ('article', 1)]",[],[],10.1145/3501401,Arabic Fake News Detection: A Fact Checking Based Deep Learning Approach
2583,4,"[('behavior', 1), ('human', 1)]","[('the', 14), ('to', 9), ('in', 8), ('hat', 5)]","[('experiment', 1), ('research', 1)]","[('increase', 1)]","[('like', 1)]",10.1007/s41060-021-00307-8,The impact of information sources on COVID-19 knowledge accumulation and vaccination intention
2584,2,"[('human', 1), ('information', 1)]","[('and', 12), ('the', 11), ('of', 9), ('on', 9)]","[('analysis', 1), ('study', 1), ('research', 1), ('suggest', 1)]",[],"[('virtual', 1), ('data', 1), ('video', 1)]",10.1145/3473970,Modeling Global and Local Interactions for Online Conversation Recommendation
2586,3,"[('bias', 1), ('experience', 1)]","[('the', 7), ('to', 6), ('a', 5), ('their', 5)]",[],[],"[('online', 1)]",10.1080/16522354.2021.1964191,Chronic corporate performance in media-tech firms: a new perspective
2587,6,"[('human', 1), ('user', 1), ('users', 1), ('trust', 1)]","[('the', 13), ('and', 10), ('to', 9), ('conflict', 7)]","[('control', 1), ('participant', 1), ('found', 1), ('experiment', 1)]",[],"[('virtual', 1), ('user', 1)]",10.1016/j.intman.2022.100928,Cultural intelligence: An identity lens on the influence of cross-cultural experience
2589,2,"[('behavior', 1)]","[('the', 11), ('and', 10), ('to', 5), ('salesperson', 5)]","[('modeling', 1), ('negative', 1), ('found', 1), ('positive', 1)]",[],"[('data', 1)]",10.1093/sf/soac004,"What Gender Values Do Muslims Resist? How Religiosity and Acculturation Over Time Shape Muslims’ Public-Sphere Equality, Family Role Divisions, and Sexual Liberalization Values Differently"
2593,2,[],"[('the', 6), ('of', 6), ('and', 5), ('study', 3)]","[('study', 1), ('review', 1)]",[],"[('virtual', 1), ('data', 1)]",10.1080/15205436.2022.2026399,Us and Them: The Role of Group Identity in Explaining Cultural Resonance and Framing Effects
2598,2,"[('accuracy', 1)]","[('of', 9), ('the', 7), ('intelligence', 6), ('to', 6)]","[('research', 1), ('assessment', 1), ('review', 1)]",[],"[('data', 1)]",10.1002/casp.2570,Multiple group membership supports resilience and growth in response to violence and abuse
2599,9,"[('media', 1), ('social', 1), ('users', 1), ('experience', 1)]","[('to', 9), ('the', 9), ('insults', 9), ('and', 7)]","[('analysis', 1), ('study', 1), ('mean', 1), ('theoretical', 1)]",[],"[('twitter', 1), ('content', 1), ('data', 1), ('social', 1)]",10.1111/jasp.12868,The burden of being certain: National identity certainty predicts support for COVID‐Related restrictive measures and outgroup conspiracy beliefs
2602,4,"[('news', 1), ('misinformation', 1), ('conspiracy', 1), ('fake', 1)]","[('ih', 8), ('to', 8), ('and', 4), ('endorsing/believing', 4)]","[('measure', 1), ('negative', 1)]",[],[],10.1177/13634615221080231,Transgenerational trauma in Rwandan genocidal rape survivors and their children: A culturally enhanced bioecological approach.
2603,2,"[('false', 1), ('information', 1)]","[('the', 15), ('of', 12), ('to', 9), ('and', 9)]","[('result', 1), ('positive', 1), ('study', 1), ('suggest', 1)]",[],"[('online', 1), ('data', 1), ('content', 1)]",10.1080/03069885.2022.2039899,"Trust, inflammatory biomarkers and adversity: a novel investigation and clinical implications"
2605,4,"[('voice', 1), ('behavior', 1), ('social', 1)]","[('and', 10), ('oer', 6), ('csr', 5), ('of', 5)]","[('study', 1), ('positive', 1), ('regression', 1), ('review', 1)]",[],"[('voice', 1), ('online', 1), ('data', 1), ('social', 1)]",10.3390/brainsci12010067,The Contagion of Psychopathology across Different Psychiatric Disorders: A Comparative Theoretical Analysis
2606,10,"[('fake', 1), ('bias', 1), ('trust', 1), ('social', 1)]","[('the', 10), ('and', 10), ('to', 9), ('in', 5)]","[('detection', 1), ('overall', 1), ('theoretical', 1)]","[('increase', 1)]","[('online', 1), ('media', 1), ('social', 1)]",10.1016/j.neubiorev.2022.104579,"Contributions of epigenetic inheritance to the predisposition of major psychiatric disorders: theoretical framework, evidence, and implications"
2608,3,"[('information', 1), ('exposure', 1)]","[('the', 14), ('and', 14), ('of', 9), ('cancer', 7)]","[('confidence', 1), ('study', 1), ('participant', 1), ('meta-analysis', 1)]",[],"[('data', 1)]",10.1016/j.tourman.2022.104501,Impact of corporate social (ir)responsibility on volume and valence of online employee reviews: Evidence from the tourism and hospitality industry
2610,3,"[('voice', 1), ('news', 1)]","[('the', 8), ('to', 6), ('climate', 5), ('analysis', 4)]","[('analysis', 1), ('study', 1), ('found', 1), ('semantic', 1)]",[],"[('voice', 1)]",10.3390/rel13030250,Memory of Conflicts and Perceived Threat as Relevant Mediators of Interreligious Conflicts
2612,6,"[('false', 1), ('information', 1), ('user', 1), ('social', 1)]","[('the', 14), ('of', 12), ('in', 9), ('vaccine', 7)]","[('analysis', 1), ('analyze', 1)]","[('finding', 1)]","[('twitter', 1), ('content', 1), ('user', 1), ('social', 1)]",10.1016/j.jbef.2022.100639,"Easy to shove, difficult to show: Effect of educative and default nudges on financial self-management"
2613,2,"[('social', 1)]","[('and', 6), ('the', 5), ('a', 3), ('on', 3)]","[('study', 1), ('article', 1)]",[],"[('social', 1)]",10.1007/s10676-021-09594-y,What it’s like to be a _____: why it’s (often) unethical to use VR as an empathy nudging tool
2615,4,"[('news', 1), ('misinformation', 1), ('conspiracy', 1), ('fake', 1)]","[('ih', 8), ('to', 8), ('and', 4), ('endorsing/believing', 4)]","[('measure', 1), ('negative', 1)]",[],[],10.1016/j.enpol.2022.112904,Who pays the loyalty tax? The relationship between socioeconomic status and switching in Australia&#x27;s retail electricity markets
2618,8,"[('misinformation', 1), ('disinformation', 1), ('fake', 1), ('news', 1)]","[('and', 9), ('the', 9), ('misperceptions', 9), ('ine', 8)]","[('survey', 1), ('research', 1), ('model', 1), ('impact', 1)]",[],"[('data', 1), ('media', 1), ('social', 1)]",10.1136/medethics-2020-106077,Public health nudges: weighing individual liberty and population health benefits
2619,2,"[('users', 1)]","[('of', 13), ('the', 13), ('climate', 8), ('and', 8)]","[('research', 1), ('result', 1), ('assessment', 1)]",[],"[('community', 1)]",10.1016/b978-0-12-820195-4.00049-2,State Torture
2620,7,"[('disinformation', 1), ('label', 1), ('information', 1), ('social', 1)]","[('the', 8), ('content', 8), ('to', 5), ('and', 5)]","[('article', 1), ('research', 1), ('review', 1)]",[],"[('online', 1), ('content', 1), ('social', 1), ('media', 1)]",10.1111/rego.12460,Support for behavioral nudges versus alternative policy instruments and their perceived fairness and efficacy
2621,4,"[('design', 1), ('information', 1)]","[('the', 16), ('two-sided', 11), ('messages', 10), ('in', 9)]","[('controlled', 1), ('negative', 1), ('intervention', 1), ('difference', 1)]","[('intervention', 1)]","[('online', 1)]",10.1016/j.compenvurbsys.2022.101790,A social sensing approach for everyday urban problem-handling with the 12345-complaint hotline data
2622,6,"[('fake', 1), ('information', 1), ('social', 1), ('media', 1)]","[('the', 17), ('to', 9), ('news', 8), ('fake', 6)]","[('propose', 1), ('confidence', 1), ('research', 1), ('model', 1)]",[],"[('media', 1), ('social', 1), ('content', 1)]",10.3390/laws11010009,Nudging and Other Behaviourally Based Policies as Enablers for Environmental Sustainability
2623,3,"[('bias', 1)]","[('the', 18), ('of', 10), ('height', 9), ('to', 7)]","[('analysis', 1), ('series', 1), ('research', 1), ('model', 1)]",[],"[('digital', 1), ('profile', 1)]",10.1016/j.enbuild.2022.111958,Application of cumulative prospect theory in understanding energy retrofit decision: A study of homeowners in the Netherlands
2625,3,"[('design', 1), ('information', 1)]","[('and', 13), ('the', 10), ('of', 9), ('natural', 6)]","[('propose', 1), ('recent', 1), ('impact', 1), ('negative', 1)]","[('increase', 1)]",[],10.1017/s1366728921001012,Decision-making depends on language: A meta-analysis of the Foreign Language Effect
2626,11,"[('misinformation', 1), ('disinformation', 1), ('fake', 1), ('counter', 1)]","[('the', 19), ('of', 12), ('and', 11), ('in', 11)]","[('analysis', 1), ('study', 1), ('research', 1), ('field', 1)]",[],"[('web', 1), ('content', 1), ('data', 1), ('digital', 1)]",10.1002/job.2620,"More depleted, speak up more? A daily examination of the benefit and cost of depletion for voice behavior and voice endorsement"
2627,3,"[('misinformation', 1)]","[('the', 9), ('in', 6), ('on', 5), ('of', 5)]","[('found', 1), ('suggest', 1), ('study', 1), ('experiment', 1)]",[],"[('online', 1), ('conversational', 1)]",10.1016/j.jebo.2022.01.020,Groups and socially responsible production: An experiment with farmers
2629,7,"[('misinformation', 1), ('belief', 1), ('information', 1), ('social', 1)]","[('i', 20), ('the', 18), ('of', 14), ('and', 14)]","[('negative', 1), ('survey', 1), ('study', 1), ('model', 1)]",[],"[('twitter', 1), ('online', 1), ('digital', 1), ('data', 1)]",10.1016/j.jebo.2022.02.020,Does native country turmoil predict immigrant workers’ honesty in markets?
2630,2,"[('design', 1), ('social', 1)]","[('the', 13), ('policy', 13), ('and', 11), ('of', 9)]","[('argue', 1), ('impact', 1), ('research', 1)]","[('increase', 1)]","[('community', 1), ('social', 1)]",10.1016/j.jesp.2022.104312,Honestly hungry: Acute hunger does not increase unethical economic behaviour
2632,8,"[('persuasion', 1), ('attitudinal', 1), ('user', 1), ('news', 1)]","[('of', 7), ('and', 6), ('the', 5), ('to', 4)]","[('framework', 1), ('experiment', 1), ('study', 1), ('suggest', 1)]",[],"[('online', 1), ('content', 1), ('user', 1), ('like', 1)]",10.1007/s12564-022-09754-9,Influence of school leadership on collective teacher efficacy: a cross-cultural meta-analysis
2633,3,"[('boost', 1), ('misinformation', 1), ('social', 1), ('exposure', 1)]","[('the', 6), ('misinformation', 6), ('of', 5), ('to', 5)]","[('research', 1), ('review', 1)]",[],"[('online', 1), ('social', 1)]",10.1037/apl0000878,Mindfulness Attenuates Both Emotional and Behavioral Reactions Following Psychological Contract Breach: A Two-Stage Moderated Mediation Model
2638,5,"[('behavior', 1), ('persuasion', 1)]","[('to', 8), ('and', 7), ('language', 6), ('the', 5)]","[('study', 1), ('found', 1), ('experiment', 1)]",[],"[('online', 1), ('reach', 1), ('data', 1)]",10.1145/3503795,Enabling Morally Sensitive Robotic Clarification Requests
2639,3,"[('prosocial', 1), ('design', 1), ('social', 1), ('behavior', 1)]","[('the', 18), ('to', 9), ('in', 8), ('that', 8)]","[('tested', 1), ('suggest', 1), ('study', 1)]",[],"[('social', 1)]",10.1007/s11299-022-00286-8,Do self-talk phrases affect behavior in ultimatum games?
2642,2,"[('design', 1)]","[('the', 13), ('of', 12), ('design', 6), ('and', 6)]","[('study', 1), ('research', 1), ('theoretical', 1)]",[],"[('moderation', 1)]",10.1016/j.jebo.2020.06.022,Similarity increases collaborative cheating
2647,2,"[('social', 1)]","[('to', 11), ('the', 10), ('for', 8), ('successes', 7)]","[('found', 1), ('study', 1), ('research', 1), ('suggest', 1)]",[],"[('social', 1)]",10.1016/j.jesp.2022.104300,The relationship between power and secrecy
2648,4,"[('prosocial', 1), ('choice', 1), ('social', 1)]","[('a', 12), ('the', 11), ('prosocial', 9), ('to', 8)]","[('subjects', 1), ('dyad', 1), ('found', 1), ('experiment', 1)]",[],"[('social', 1)]",10.3389/fpsyg.2021.704790,"Goal Missed, Self Hit: Goal-Setting, Goal-Failure, and Their Affective, Motivational, and Behavioral Consequences"
2649,3,"[('choice', 1), ('behavior', 1), ('trump', 1), ('social', 1)]","[('and', 7), ('in', 5), ('whites', 5), ('’', 5)]","[('negative', 1), ('positive', 1), ('research', 1), ('impact', 1)]",[],"[('data', 1), ('social', 1)]",10.1108/ijcma-10-2021-0157,Deception by device: are we more self-serving on laptops or cell phones?
2650,3,"[('humane', 1), ('media', 1), ('social', 1), ('news', 1)]","[('the', 16), ('in', 11), ('of', 9), ('to', 9)]","[('analysis', 1), ('study', 1), ('articles', 1), ('series', 1)]",[],"[('media', 1), ('social', 1)]",10.1016/j.chb.2022.107201,Internet addiction in young adults: A meta-analysis and systematic review
2652,4,"[('design', 1), ('social', 1)]","[('the', 14), ('to', 13), ('a', 12), ('cheating', 10)]","[('questionnaire', 1), ('detection', 1), ('stimuli', 1)]",[],"[('content', 1), ('social', 1)]",10.3389/fnagi.2021.803080,Global Functional Connectivity Analysis Indicating Dysconnectivity of the Hate Circuit in Major Depressive Disorder
2653,2,"[('choice', 1), ('behavior', 1), ('social', 1)]","[('the', 10), ('and', 9), ('of', 8), ('behavioral', 6)]","[('study', 1), ('field', 1)]",[],"[('data', 1), ('social', 1)]",10.1525/collabra.32661,Machine Learning Mega-Analysis Applied to the Response Time Concealed Information Test: No Evidence for Advantage of Model-Based Predictors Over Baseline
2658,3,"[('civil', 1), ('trust', 1)]","[('the', 20), ('of', 12), ('in', 6), ('to', 5)]","[('positive', 1), ('test', 1), ('suggest', 1), ('impact', 1)]",[],"[('data', 1)]",10.1007/s40979-021-00097-3,"Do preservice teachers cheat in college, too? A quantitative study of academic integrity among preservice teachers"
2659,3,"[('human', 1), ('media', 1), ('news', 1)]","[('and', 7), ('of', 5), ('the', 5), ('in', 5)]","[('negative', 1), ('positive', 1), ('analysis', 1), ('study', 1)]",[],"[('online', 1), ('data', 1), ('media', 1)]",10.1016/j.jebo.2022.01.020,Groups and socially responsible production: An experiment with farmers
2664,2,"[('bias', 1)]","[('the', 10), ('a', 7), ('that', 6), ('management', 5)]","[('analysis', 1), ('study', 1), ('overall', 1), ('negative', 1)]","[('increase', 1)]",[],10.1016/j.joep.2022.102485,A reference point bias in judging cheaters
2677,2,"[('trust', 1)]","[('the', 15), ('and', 12), ('reliance', 10), ('of', 9)]","[('modeling', 1), ('survey', 1), ('study', 1), ('analysis', 1)]",[],"[('data', 1)]",10.1093/esr/jcac016,Rebel without a Cause: The Effects of Social Origins and Disposable Income on Rule Violations
2678,2,"[('behavior', 1), ('nudge', 1)]","[('of', 6), ('nudges', 6), ('and', 6), ('for', 5)]","[('experiment', 1), ('recent', 1), ('test', 1), ('survey', 1)]",[],[],10.1177/09567976211042379,Perturbation of Right Dorsolateral Prefrontal Cortex Makes Power Holders Less Resistant to Tempting Bribes
2679,2,[],"[('the', 7), ('and', 6), ('lower', 6), ('are', 5)]","[('survey', 1), ('article', 1)]","[('increase', 1)]","[('data', 1)]",10.1016/j.cnsns.2021.106186,Knowledge transmission model in the multiplex networks with consideration of online and offline channels
2680,2,"[('social', 1)]","[('of', 6), ('advice', 6), ('and', 5), ('be', 5)]","[('analysis', 1), ('measure', 1)]",[],"[('social', 1)]",10.3758/s13423-021-01936-7,Cognitive strategies for managing cheating: The roles of cognitive abilities in managing moral shortcuts
2681,5,"[('information', 1), ('trust', 1)]","[('the', 22), ('of', 16), ('and', 10), ('trust', 7)]","[('framework', 1), ('analysis', 1), ('research', 1), ('theoretical', 1)]",[],"[('web', 1), ('profile', 1), ('content', 1)]",10.1016/j.jesp.2022.104285,Are implicit attitudes toward dishonesty associated with self-serving dishonesty? Implications for the reliability of the IAT
2682,3,"[('design', 1), ('bias', 1)]","[('the', 16), ('and', 13), ('gm', 11), ('of', 10)]","[('survey', 1), ('study', 1), ('research', 1)]",[],"[('online', 1)]",10.1016/j.jesp.2022.104284,Reflexive or reflective? Group bias in third-party punishment in Chinese and Western cultures
2687,4,"[('social', 1), ('trust', 1)]","[('trust', 8), ('scientists', 6), ('to', 6), ('is', 5)]","[('argue', 1), ('negative', 1)]",[],"[('content', 1), ('social', 1)]",10.3389/fmed.2022.820624,The Efficacy and Safety of Early Renal Replacement Therapy in Critically Ill Patients With Acute Kidney Injury: A Meta-Analysis With Trial Sequential Analysis of Randomized Controlled Trials
2694,3,"[('design', 1)]","[('and', 17), ('in', 9), ('cbct', 8), ('with', 6)]","[('control', 1), ('controlled', 1), ('intervention', 1), ('found', 1)]","[('compassion', 1), ('intervention', 1)]",[],10.1016/j.drugpo.2021.103571,&quot;It&#x27;s a revolving door&quot;: Ego-depletion among prisoners with injecting drug use histories as a barrier to post-release success
2699,6,"[('design', 1), ('boosting', 1), ('information', 1), ('social', 1)]","[('the', 23), ('and', 18), ('of', 17), ('social', 7)]","[('test', 1), ('study', 1), ('suggest', 1), ('model', 1)]","[('decrease', 1)]","[('social', 1)]",10.1177/10596011221081281,The Machiavellian Organization: A Multilevel Model to Understand Decision Making in Organizations
2703,3,"[('design', 1)]","[('and', 17), ('in', 9), ('cbct', 8), ('with', 6)]","[('control', 1), ('controlled', 1), ('intervention', 1), ('found', 1)]","[('compassion', 1), ('intervention', 1)]",[],10.1016/j.joep.2022.102491,Do restaurant customers who receive an unreasonably low bill bring it to the server’s attention? A field experiment on dishonesty
2708,3,"[('human', 1)]","[('and', 7), ('at', 6), ('in', 6), ('were', 6)]","[('overall', 1), ('intervention', 1)]","[('intervention', 1)]","[('data', 1)]",10.1002/job.2620,"More depleted, speak up more? A daily examination of the benefit and cost of depletion for voice behavior and voice endorsement"
2713,3,[],"[('and', 22), ('the', 8), ('of', 8), ('were', 7)]","[('analysis', 1), ('study', 1), ('mean', 1), ('control', 1)]","[('increase', 1)]","[('data', 1), ('profile', 1)]",10.1016/j.newideapsych.2022.100937,New directions in research on somatic concerns in individuals with eating disorders
2717,3,"[('exposure', 1), ('experience', 1)]","[('the', 16), ('and', 13), ('to', 12), ('of', 11)]","[('found', 1), ('experiment', 1), ('study', 1), ('research', 1)]",[],"[('virtual', 1)]",10.1371/journal.pone.0264535,Internal conflict and prejudice-regulation: Emotional ambivalence buffers against defensive responding to implicit bias feedback
2719,2,"[('design', 1), ('behavior', 1), ('social', 1)]","[('and', 10), ('television', 9), ('of', 9), ('a', 8)]","[('research', 1), ('interview', 1)]",[],"[('data', 1), ('social', 1)]",10.1016/j.tics.2022.02.002,The relationship between habits and motor skills in humans
2726,4,"[('information', 1), ('social', 1)]","[('the', 11), ('of', 10), ('to', 8), ('we', 8)]","[('series', 1), ('research', 1), ('test', 1), ('participant', 1)]",[],"[('online', 1), ('social', 1)]",10.1016/j.jesp.2022.104297,Revisiting dissociation hypotheses with a structural fit approach: The case of the prepared reflex framework
2727,7,"[('media', 1), ('social', 1)]","[('indigenous', 7), ('media', 7), ('to', 7), ('in', 7)]","[('analysis', 1), ('competition', 1), ('impact', 1)]",[],"[('virtual', 1), ('online', 1), ('content', 1), ('social', 1)]",10.3917/resg.144.0103,La théorie de l’esprit du vendeur et l’empathie : similitudes et différences
2730,4,"[('information', 1), ('experience', 1)]","[('the', 13), ('of', 11), ('experimental', 5), ('and', 5)]","[('subjects', 1), ('argue', 1), ('analysis', 1), ('study', 1)]","[('decrease', 1)]","[('online', 1)]",10.1007/978-3-030-94032-4_7,"Neuroscience, Neurolaw, and Neurorights"
2732,3,[],"[('the', 7), ('to', 7), ('voter', 7), ('id', 5)]","[('analysis', 1), ('study', 1), ('confidence', 1), ('overall', 1)]","[('finding', 1)]","[('data', 1), ('content', 1)]",10.1016/j.bbr.2022.113828,Noradrenergic innervations of the medial prefrontal cortex mediate empathy for pain in rats via the α1 and β receptors
2733,3,"[('humane', 1), ('media', 1), ('social', 1), ('news', 1)]","[('the', 16), ('in', 11), ('of', 9), ('to', 9)]","[('analysis', 1), ('study', 1), ('articles', 1), ('series', 1)]",[],"[('media', 1), ('social', 1)]",10.1016/j.ijpsycho.2021.12.004,Neural correlates of compassion – An integrative systematic review
