,wordscore,most_freq_target_words,most_freq_all_words,study_design_hunch,impact_of_study_hunch,tech_words_freq,_doi,_title
1232,5,"[('behavior', 1), ('belief', 1), ('information', 1), ('bias', 1)]","[('the', 10), ('of', 7), ('to', 4), ('and', 4)]","[('propose', 1), ('framework', 1), ('analyze', 1), ('suggest', 1)]",[],"[('data', 1)]",10.1111/pops.12811,MOBILISE: A Higher‐Order Integration of Collective Action Research to Address Global Challenges
1234,6,"[('media', 1), ('social', 1)]","[('of', 10), ('and', 6), ('engagement', 5), ('the', 4)]","[('study', 1), ('framework', 1)]",[],"[('media', 1), ('social', 1), ('facebook', 1), ('content', 1)]",10.1111/jnc.15607,A neurobiological perspective on social influence: Serotonin and social adaptation
1235,2,"[('behavior', 1), ('consumer', 1)]","[('the', 12), ('and', 8), ('of', 6), ('variety', 5)]","[('study', 1), ('model', 1), ('regression', 1)]",[],[],10.1016/j.jmro.2022.100038,Functional and volumetric cortico-cerebellar alterations in congenital blind children associated with language processing
1237,3,"[('media', 1), ('social', 1)]","[('self-disclosure', 9), ('and', 6), ('of', 5), ('social', 5)]","[('suggest', 1), ('review', 1)]",[],"[('online', 1), ('digital', 1), ('media', 1), ('social', 1)]",10.1093/cercor/bhac102,Prediction and action in cortical pain processing.
1239,7,"[('behavior', 1), ('information', 1), ('social', 1), ('accuracy', 1)]","[('the', 13), ('of', 9), ('in', 6), ('and', 5)]","[('tested', 1), ('battery', 1), ('study', 1)]",[],"[('data', 1), ('social', 1), ('video', 1)]",10.1177/19485506211057976,Three Dimensions of American Conservative Political Orientation Differentially Predict Negativity Bias and Satisfaction With Life
1240,8,"[('accuracy', 1), ('behavior', 1), ('user', 1), ('users', 1)]","[('of', 6), ('the', 5), ('and', 5), ('from', 4)]","[('study', 1), ('found', 1), ('predictions', 1), ('test', 1)]",[],"[('digital', 1), ('privacy', 1), ('data', 1), ('user', 1)]",10.1098/rstb.2020.0444,Neural systems that facilitate the representation of social rank
1248,5,"[('social', 1), ('experience', 1)]","[('and', 7), ('online', 6), ('the', 5), ('to', 5)]","[('study', 1), ('positive', 1), ('negative', 1)]",[],"[('online', 1), ('digital', 1), ('social', 1)]",10.3389/fpsyg.2021.787417,The Influence of the Disadvantaged Mindset on System-Justifying Beliefs
1250,2,"[('design', 1)]","[('and', 13), ('t1', 13), ('relationship', 12), ('the', 11)]","[('mean', 1), ('negative', 1)]","[('increase', 1)]",[],10.1093/cercor/bhab461,"Brain Adaptation to Acute Stress: Effect of Time, Social Buffering, and Nicotinic Cholinergic System"
1251,3,"[('information', 1), ('users', 1)]","[('mathematics', 11), ('and', 11), ('problematic', 7), ('smartphone', 7)]","[('study', 1), ('research', 1), ('test', 1), ('questionnaire', 1)]",[],"[('online', 1)]",10.1016/j.aej.2021.08.005,The influence of the public’s prior knowledge on their acceptance of risk control method for contaminated sites: A case study in China
1255,2,"[('counter', 1)]","[('the', 19), ('to', 10), ('precise', 6), ('buyers', 6)]","[('experiment', 1), ('overall', 1), ('predictions', 1), ('test', 1)]","[('increase', 1)]",[],10.1037/cep0000273,Bridging People and Perspectives: General and Language-Specific Social Network Structure Predict Mentalizing Across Diverse Sociolinguistic Contexts
1258,8,"[('behavior', 1), ('human', 1), ('social', 1), ('interface', 1)]","[('the', 21), ('of', 19), ('use', 16), ('smartphone', 12)]","[('measure', 1), ('positive', 1), ('negative', 1)]",[],"[('online', 1), ('data', 1), ('digital', 1), ('social', 1)]",10.1016/j.jbusres.2022.01.075,Are consumers consistent in their sustainable behaviours? A longitudinal study on consistency and spillover
1259,2,"[('behavior', 1), ('social', 1)]","[('recycling', 8), ('and', 7), ('to', 6), ('intention', 6)]","[('control', 1), ('survey', 1), ('study', 1), ('analyze', 1)]",[],"[('data', 1), ('social', 1), ('community', 1)]",10.1016/j.leaqua.2021.101563,Leadership selection: Can changing the default break the glass ceiling?
1263,5,"[('social', 1), ('experience', 1)]","[('and', 7), ('online', 6), ('the', 5), ('to', 5)]","[('study', 1), ('positive', 1), ('negative', 1)]",[],"[('online', 1), ('digital', 1), ('social', 1)]",10.1007/s10799-022-00363-x,"Investor participation in reward-based crowdfunding: impacts of entrepreneur efforts, platform characteristics, and perceived value"
1264,4,"[('behavior', 1), ('social', 1)]","[('avatar', 9), ('and', 7), ('a', 5), ('the', 5)]","[('analyzed', 1)]",[],"[('virtual', 1), ('social', 1)]",10.1016/j.envsci.2022.02.022,"Comparing normative and descriptive methods for multi-criteria decision analysis: A case study evaluating wetland restoration opportunities in the Chesapeake Bay watershed, USA"
1267,3,"[('behavior', 1), ('human', 1), ('exposure', 1)]","[('the', 12), ('to', 6), ('sms', 5), ('in', 4)]","[('control', 1), ('experiment', 1)]",[],[],10.1016/j.jretconser.2021.102831,When e-commerce becomes more human by transposing the hospitality concept to merchant websites
1270,2,"[('behavior', 1), ('media', 1), ('social', 1), ('users', 1)]","[('and', 14), ('the', 13), ('of', 9), ('use', 7)]","[('study', 1), ('analyzed', 1), ('regression', 1)]",[],"[('data', 1), ('profile', 1), ('media', 1), ('social', 1)]",10.1016/j.tourman.2021.104459,The interplay of hedonic trend and time pressure in the evaluation of multi-episode tour experiences
1273,9,"[('experience', 1), ('social', 1), ('user', 1), ('users', 1)]","[('of', 10), ('to', 9), ('the', 9), ('and', 9)]","[('analysis', 1), ('study', 1), ('research', 1), ('suggest', 1)]",[],"[('websites', 1), ('facebook', 1), ('data', 1), ('user', 1)]",10.1080/1350178x.2022.2049854,Economics is converging with sociology but not with psychology
1274,2,"[('behavior', 1), ('media', 1), ('social', 1), ('users', 1)]","[('and', 14), ('the', 13), ('of', 9), ('use', 7)]","[('study', 1), ('analyzed', 1), ('regression', 1)]",[],"[('data', 1), ('profile', 1), ('media', 1), ('social', 1)]",10.3389/fpsyg.2022.800528,Set Size and Donation Behavior
1275,2,"[('behavior', 1), ('media', 1), ('social', 1), ('users', 1)]","[('and', 14), ('the', 13), ('of', 9), ('use', 7)]","[('study', 1), ('analyzed', 1), ('regression', 1)]",[],"[('data', 1), ('profile', 1), ('media', 1), ('social', 1)]",10.1177/03611981211046924,Nudging Consumers Toward Greener Air Travel by Adding Carbon to the Equation in Online Flight Search
1280,2,"[('social', 1)]","[('the', 12), ('of', 12), ('in', 5), ('hatred', 5)]","[('research', 1), ('argue', 1), ('recent', 1), ('negative', 1)]",[],"[('social', 1)]",10.1177/01461672221077791,"Anxiety, Cognitive Availability, and the Talisman Effect of Insurance."
1281,3,"[('experience', 1)]","[('the', 21), ('of', 19), ('and', 9), ('‘', 6)]","[('analysis', 1), ('call', 1), ('semantic', 1)]",[],"[('digital', 1), ('facebook', 1)]",10.1016/j.joep.2022.102504,Costly information acquisition: The influence of stakeholder earnings
1286,3,"[('social', 1), ('experience', 1)]","[('the', 9), ('of', 9), ('intergroup', 7), ('conflict', 5)]","[('research', 1), ('suggest', 1), ('controlled', 1)]",[],"[('social', 1)]",10.1016/j.ijme.2022.100637,Do you think we are a match? The predictive power of matching activities for prospective students of an international business program
1288,3,"[('social', 1), ('experience', 1)]","[('of', 8), ('and', 6), ('collective', 5), ('emotion', 5)]",[],[],"[('social', 1)]",10.1016/j.aos.2021.101295,Target setting with compensation discretion: How are ex ante targets affected when superiors have ex post discretion?
1291,3,"[('social', 1), ('experience', 1)]","[('the', 9), ('of', 9), ('intergroup', 7), ('conflict', 5)]","[('research', 1), ('suggest', 1), ('controlled', 1)]",[],"[('social', 1)]",10.1016/j.jbusvent.2022.106210,Persist or let it go: Do rational entrepreneurs make decisions rationally?
1293,2,"[('voice', 1), ('behavior', 1), ('design', 1)]","[('a', 10), ('voice', 9), ('i', 8), ('that', 7)]","[('propose', 1), ('field', 1), ('experiment', 1), ('argue', 1)]",[],"[('voice', 1), ('online', 1)]",10.1016/j.paid.2022.111560,Personality traits and long-term care financial risks among older Americans
1295,3,"[('design', 1), ('experience', 1), ('interface', 1)]","[('learning', 8), ('and', 8), ('of', 8), ('interest', 5)]","[('field', 1), ('experiment', 1), ('study', 1), ('research', 1)]",[],[],10.1016/j.worlddev.2022.105818,Increasing engagement in price crowdsourcing initiatives: Using nudges in Nigeria
1296,6,"[('voice', 1), ('social', 1), ('experience', 1)]","[('for', 11), ('intergroup', 7), ('contact', 7), ('in', 7)]","[('overall', 1), ('result', 1), ('predictions', 1), ('survey', 1)]",[],"[('voice', 1), ('data', 1), ('social', 1)]",10.1016/j.obhdp.2022.104147,You can’t handle the truth! Conflict counterparts over-estimate each other’s feelings of self-threat
1297,3,"[('social', 1), ('experience', 1)]","[('the', 9), ('of', 9), ('intergroup', 7), ('conflict', 5)]","[('research', 1), ('suggest', 1), ('controlled', 1)]",[],"[('social', 1)]",10.1108/jaar-01-2021-0005,How to de-bias investment judgements–unpacking bias and possible remedies in a capital investment context
1298,6,"[('media', 1), ('social', 1), ('users', 1), ('experience', 1)]","[('and', 10), ('to', 10), ('online', 7), ('harassment', 7)]","[('modeling', 1), ('intervention', 1), ('found', 1), ('survey', 1)]","[('intervention', 1)]","[('online', 1), ('data', 1), ('media', 1), ('social', 1)]",10.3389/fpsyg.2022.729285,"Reference Dependence in Bayesian Reasoning: Value Selection Bias, Congruence Effects, and Response Prompt Sensitivity"
1299,3,"[('social', 1), ('users', 1), ('experience', 1)]","[('of', 13), ('the', 8), ('discrimination', 7), ('and', 7)]","[('survey', 1), ('study', 1), ('found', 1), ('theoretical', 1)]",[],"[('online', 1), ('community', 1), ('social', 1)]",10.1016/j.paid.2021.111458,Beware the inexperienced financial advisor with a high trait emotional intelligence: Psychological determinants of the misperception of the risk-return relationship
1302,2,"[('news', 1)]","[('european', 8), ('the', 6), ('election', 5), ('and', 3)]","[('analysis', 1), ('argue', 1), ('theoretical', 1)]",[],"[('content', 1)]",10.1016/j.socec.2022.101870,On the Psychology of Bonuses: The Effects of Loss Aversion and Yerkes-Dodson Law on Performance in Cognitively and Mechanically Demanding Tasks
1304,3,"[('social', 1), ('experience', 1)]","[('the', 9), ('of', 9), ('intergroup', 7), ('conflict', 5)]","[('research', 1), ('suggest', 1), ('controlled', 1)]",[],"[('social', 1)]",10.1016/j.techfore.2022.121486,"Recommendation technologies and consumption diversity: An experimental study on product recommendations, consumer search, and sales diversity"
1310,5,"[('media', 1), ('social', 1)]","[('the', 16), ('of', 10), ('hate', 7), ('crimes', 6)]","[('research', 1)]",[],"[('community', 1), ('media', 1), ('social', 1)]",10.1016/j.im.2021.103571,Scratch my back and I&#x27;ll scratch yours: The impact of user effort and recommendation agent effort on perceived recommendation agent quality
1313,3,"[('experience', 1), ('social', 1), ('exposure', 1)]","[('the', 12), ('and', 9), ('women', 6), ('of', 6)]","[('study', 1), ('research', 1), ('article', 1), ('intervention', 1)]","[('intervention', 1)]","[('data', 1), ('social', 1)]",10.1016/j.jretconser.2021.102896,Same but different - The effect of the unit of measure on the valuation of a unit price
1314,2,"[('human', 1), ('guilt', 1)]","[('to', 6), ('collective', 6), ('the', 4), ('is', 4)]","[('propose', 1), ('negative', 1), ('article', 1)]",[],[],10.1016/j.orl.2019.09.009,Assortment optimization under the multinomial logit model with product synergies
1317,3,"[('social', 1), ('experience', 1)]","[('the', 9), ('of', 9), ('intergroup', 7), ('conflict', 5)]","[('research', 1), ('suggest', 1), ('controlled', 1)]",[],"[('social', 1)]",10.1287/mksc.2022.1359,Search Gaps and Consumer Fatigue
1318,5,"[('social', 1), ('exposure', 1)]","[('and', 12), ('crp', 11), ('ptsd', 8), ('of', 8)]","[('found', 1), ('overall', 1), ('study', 1), ('review', 1)]","[('modulate', 1)]","[('data', 1), ('social', 1)]",10.1016/j.obhdp.2020.01.011,Let’s choose one of each: Using the partition dependence effect to increase diversity in organizations
1319,5,"[('media', 1), ('information', 1), ('experience', 1)]","[('group', 7), ('information', 6), ('about', 5), ('when', 5)]","[('confidence', 1), ('research', 1), ('impact', 1)]",[],"[('media', 1), ('like', 1)]",10.1136/bmjnph-2021-000376,"Potential effect of real-world junk food and sugar-sweetened beverage taxes on population health, health system costs and greenhouse gas emissions in New Zealand: a modelling study"
1320,3,"[('social', 1), ('experience', 1)]","[('the', 9), ('of', 9), ('intergroup', 7), ('conflict', 5)]","[('research', 1), ('suggest', 1), ('controlled', 1)]",[],"[('social', 1)]",10.1002/smj.3392,Communication frames and beneficiary engagement in corporate social initiatives: Evidence from a randomized controlled trial in France
1323,3,"[('behavior', 1), ('consumer', 1)]","[('the', 11), ('of', 8), ('sacrificial', 7), ('and', 7)]","[('study', 1), ('research', 1)]",[],"[('community', 1)]",10.1287/opre.2019.1961,Asset Selling Under Debt Obligations
1326,3,"[('information', 1), ('news', 1)]","[('people', 7), ('we', 5), ('and', 5), ('’', 4)]","[('analysis', 1), ('article', 1)]","[('increase', 1)]",[],10.1177/00222437211070589,Default Effects of Credit Card Minimum Payments
1327,3,"[('belief', 1), ('exposure', 1)]","[('and', 9), ('in', 8), ('the', 7), ('god', 6)]","[('correlational', 1), ('found', 1), ('study', 1)]","[('increase', 1)]",[],10.1177/1069031x211073821,"Choice Deprivation, Choice Overload, and Satisfaction with Choices Across Six Nations"
1334,3,"[('social', 1), ('experience', 1)]","[('the', 9), ('of', 9), ('intergroup', 7), ('conflict', 5)]","[('research', 1), ('suggest', 1), ('controlled', 1)]",[],"[('social', 1)]",10.1016/j.ejor.2021.05.024,Betting market equilibrium with heterogeneous beliefs: A prospect theory-based model
1335,7,"[('behavior', 1), ('information', 1), ('media', 1), ('social', 1)]","[('the', 15), ('of', 10), ('and', 7), ('a', 6)]","[('subjects', 1), ('negative', 1), ('correlational', 1), ('positive', 1)]",[],"[('data', 1), ('media', 1), ('social', 1)]",10.3390/math9222940,Research on Extreme Dispute Decisions of Large-Scale Engineering Projects from the Perspective of Multidimensional Preferences
1338,2,"[('exposure', 1)]","[('of', 6), ('conflict', 5), ('and', 5), ('for', 4)]","[('framework', 1), ('recent', 1), ('test', 1), ('survey', 1)]",[],"[('data', 1)]",10.1007/s10796-020-10077-6,Influence of Habits on Mobile Payment Acceptance: An Ecosystem Perspective
1339,3,"[('social', 1), ('experience', 1)]","[('the', 9), ('of', 9), ('intergroup', 7), ('conflict', 5)]","[('research', 1), ('suggest', 1), ('controlled', 1)]",[],"[('social', 1)]",10.1016/j.copsyc.2022.101309,Revealing the self in a digital world: a systematic review of adolescent online and offline self-disclosure
1346,2,"[('social', 1)]","[('the', 20), ('of', 14), ('and', 9), ('to', 6)]","[('study', 1), ('result', 1), ('article', 1)]",[],"[('social', 1)]",10.2196/30606,Digital Prompts to Increase Engagement With the Headspace App and for Stress Regulation Among Parents: Feasibility Study.
1347,2,"[('behavior', 1), ('social', 1)]","[('the', 11), ('support', 9), ('to', 9), ('in', 9)]","[('control', 1), ('competition', 1), ('experiment', 1), ('difference', 1)]",[],"[('online', 1), ('content', 1), ('social', 1)]",10.2147/prbm.s349105,The Effect of Parent Phubbing on Chinese Adolescents’ Smartphone Addiction During COVID-19 Pandemic: Testing a Moderated Mediation Model
1350,2,"[('human', 1), ('dehumanize', 1)]","[('the', 11), ('in', 8), ('of', 7), ('was', 7)]","[('positive', 1), ('recent', 1), ('study', 1), ('suggest', 1)]",[],[],10.51982/bagimli.990471,Examining The Correlation Between Phubbing and Life Satisfaction in Adults During Covid-19 Pandemic
1352,3,"[('civil', 1)]","[('ex-combatants', 6), ('the', 4), ('of', 4), ('a', 3)]","[('suggest', 1)]","[('finding', 1)]","[('community', 1)]",10.4018/978-1-7998-8318-0.ch008,Complexity of Digital Media Crowning the Mental Health of Adolescents
1353,3,"[('choice', 1), ('rated', 1)]","[('the', 14), ('pain', 13), ('a', 8), ('of', 8)]","[('dyad', 1), ('found', 1), ('overall', 1), ('study', 1)]","[('decrease', 1)]",[],10.1016/j.addbeh.2022.107304,Parent-child relationship and smartphone addiction among Chinese adolescents: A longitudinal moderated mediation model.
1354,3,"[('design', 1), ('social', 1)]","[('in', 12), ('the', 9), ('of', 8), ('and', 8)]","[('negative', 1), ('experiment', 1), ('meta-analysis', 1), ('positive', 1)]",[],"[('social', 1)]",10.1016/j.chb.2021.107171,"Relationships among problematic smartphone use, mathematics anxiety, learning interest, and achievement: A multiple mediation model"
1356,3,"[('experience', 1), ('trust', 1), ('belief', 1), ('information', 1)]","[('to', 10), ('are', 6), ('their', 6), ('group', 5)]","[('theoretical', 1), ('model', 1)]",[],"[('social', 1)]",10.3390/ijerph19052602,Telework and Mental Health during COVID-19
1359,2,"[('design', 1), ('prosocial', 1), ('social', 1)]","[('and', 16), ('of', 9), ('prosocial', 8), ('with', 8)]","[('negative', 1), ('positive', 1), ('research', 1), ('suggest', 1)]",[],"[('web', 1), ('social', 1)]",10.1016/j.chb.2021.107102,Online social connections as surrogates of face-to-face interactions: A longitudinal study under Covid-19 isolation
1360,5,"[('consumer', 1), ('media', 1)]","[('the', 21), ('empathy', 9), ('and', 6), ('for', 5)]","[('analysis', 1), ('study', 1), ('found', 1), ('participant', 1)]",[],"[('data', 1), ('media', 1), ('content', 1)]",10.1017/s1754470x22000095,A cognitive behavioural therapy smartphone app for adolescent depression and anxiety: co-design of ClearlyMe
1367,2,"[('human', 1)]","[('devices', 14), ('the', 13), ('smart', 12), ('of', 9)]","[('questionnaire', 1)]",[],"[('data', 1)]",10.1016/j.chbr.2022.100176,Fancy avatar identification and behaviors in the virtual world: Preceding avatar customization and succeeding communication
1369,4,"[('design', 1), ('social', 1)]","[('the', 15), ('in', 12), ('and', 10), ('of', 8)]","[('study', 1), ('impact', 1)]","[('evoke', 1)]","[('social', 1)]",10.1016/j.trf.2022.03.002,It’s all in the mind: The relationship between mindfulness and nomophobia on technology engagement while driving and aberrant driving behaviours
1378,5,"[('persuasion', 1), ('social', 1), ('bias', 1)]","[('the', 14), ('of', 13), ('and', 8), ('party', 7)]","[('field', 1), ('experiment', 1), ('observational', 1), ('positive', 1)]",[],"[('online', 1), ('social', 1)]",10.1016/j.chb.2021.107144,International perspectives on social media use among adolescents: Implications for mental and social well-being and substance use
1380,2,"[('information', 1)]","[('of', 17), ('the', 14), ('and', 11), ('to', 10)]","[('propose', 1), ('confidence', 1), ('survey', 1), ('study', 1)]",[],"[('data', 1)]",10.3389/fsoc.2022.788447,Naturalness of Face-to-Face Medium and Video-Mediated Online Communication: Doubts About Evolutionary Mismatch
1382,4,"[('persuasion', 1)]","[('the', 7), ('of', 4), ('political', 3), ('to', 2)]","[('experiment', 1), ('randomized', 1), ('field', 1)]",[],"[('online', 1), ('digital', 1), ('facebook', 1)]",10.1111/peps.12506,Exchange through emoting: An emotional model of leader–member resource exchanges
1383,2,"[('exposure', 1)]","[('of', 6), ('or', 5), ('cross-cutting', 5), ('participation', 4)]","[('negative', 1), ('meta-analysis', 1), ('experiment', 1), ('positive', 1)]",[],"[('online', 1)]",10.1177/1754073917751229,Why We Hate
1385,3,"[('information', 1)]","[('the', 11), ('imputation', 9), ('to', 8), ('mi', 8)]","[('survey', 1), ('propose', 1), ('mean', 1), ('model', 1)]",[],"[('algorithm', 1), ('data', 1)]",10.1007/s11196-021-09880-4,The ‘Spaghettification’ of Performativity Across Cultural Boundaries: The Trans-culturality/Trans-Spatiality of Digital Communication As an Event Horizon for Speech Acts
1386,4,"[('social', 1)]","[('the', 10), ('and', 8), ('of', 7), ('that', 7)]","[('propose', 1), ('impact', 1)]","[('increase', 1)]","[('data', 1), ('social', 1)]",10.1037/emo0001056,Hate: Toward Understanding Its Distinctive Features Across Interpersonal and Intergroup Targets
1388,2,"[('experience', 1)]","[('the', 9), ('of', 7), ('and', 7), ('tax', 7)]","[('analysis', 1), ('measure', 1), ('overall', 1), ('analyze', 1)]",[],"[('data', 1)]",10.1111/ajps.12697,Qualitative Imputation of Missing Potential Outcomes
1389,2,"[('trust', 1)]","[('and', 8), ('of', 7), ('the', 6), ('to', 5)]","[('study', 1), ('research', 1), ('positive', 1), ('negative', 1)]",[],"[('community', 1)]",10.1037/emo0001056,Hate: Toward Understanding Its Distinctive Features Across Interpersonal and Intergroup Targets
1392,3,"[('trust', 1), ('exposure', 1)]","[('violence', 8), ('the', 8), ('to', 6), ('of', 6)]","[('experiment', 1), ('result', 1), ('survey', 1), ('study', 1)]","[('increase', 1)]",[],10.1177/17540739211072469,Towards a Taxonomy of Collective Emotions
1393,2,"[('behavior', 1)]","[('the', 6), ('to', 5), ('cues', 5), ('local', 4)]","[('experiment', 1), ('argue', 1), ('negative', 1), ('study', 1)]",[],"[('data', 1)]",10.1111/mila.12279,Feeling the right way: Normative influences on people&#x27;s use of emotion concepts
1394,6,"[('design', 1), ('social', 1), ('users', 1)]","[('de', 19), ('the', 18), ('of', 11), ('social', 10)]","[('modeling', 1), ('result', 1), ('analysis', 1), ('analyze', 1)]","[('increase', 1)]","[('web', 1), ('twitter', 1), ('digital', 1), ('data', 1)]",10.1007/978-3-030-45996-3_37,"Hatred, Life Without Love, and the Descent into Hell"
1395,2,"[('social', 1)]","[('the', 12), ('of', 10), ('social', 7), ('and', 7)]","[('model', 1)]",[],"[('social', 1)]",10.1016/j.jesp.2022.104304,"Out of sight, out of mind: The emotional determinant of “harmful inaction” intergroup conflict"
1396,2,"[('experience', 1)]","[('international', 6), ('and', 6), ('brand', 5), ('experience', 4)]","[('found', 1), ('survey', 1), ('study', 1), ('research', 1)]",[],"[('online', 1)]",10.1037/emo0001056,Hate: Toward Understanding Its Distinctive Features Across Interpersonal and Intergroup Targets
1397,5,"[('behavior', 1), ('social', 1), ('trust', 1)]","[('of', 9), ('that', 5), ('on', 4), ('borders', 3)]","[('survey', 1), ('argue', 1)]",[],"[('data', 1), ('social', 1)]",10.1037/apl0001008,How and When Managers Reward Employees’ Voice: The Role of Proactivity Attributions
1398,2,[],"[('to', 9), ('the', 8), ('and', 7), ('of', 6)]","[('measure', 1), ('suggest', 1), ('result', 1), ('model', 1)]","[('increase', 1)]","[('reach', 1)]",10.1016/j.tourman.2021.104451,Experiencing human identity at dark tourism sites of natural disasters
1399,2,[],"[('the', 9), ('of', 5), ('is', 5), ('estimation', 4)]","[('series', 1), ('pattern', 1), ('model', 1)]",[],"[('algorithm', 1), ('data', 1)]",10.1016/j.caeo.2022.100075,Aesthetic design of app interfaces and their impact on secondary students’ interest and learning
1400,2,"[('social', 1)]","[('and', 8), ('exclusionary', 5), ('attitudes', 5), ('perspective‐getting', 4)]","[('field', 1), ('found', 1), ('experiment', 1), ('survey', 1)]",[],"[('social', 1)]",10.1037/pspi0000365,Need Satisfaction in Intergroup Contact: A Multinational Study of Pathways Toward Social Change
1401,4,"[('persuasion', 1)]","[('the', 7), ('of', 4), ('political', 3), ('to', 2)]","[('experiment', 1), ('randomized', 1), ('field', 1)]",[],"[('online', 1), ('digital', 1), ('facebook', 1)]",10.1016/j.jesp.2022.104304,"Out of sight, out of mind: The emotional determinant of “harmful inaction” intergroup conflict"
1402,4,"[('choice', 1), ('information', 1)]","[('and', 9), ('we', 8), ('to', 8), ('of', 6)]","[('observational', 1), ('result', 1), ('research', 1), ('theoretical', 1)]",[],"[('algorithm', 1), ('like', 1)]",10.1016/j.chb.2021.107022,Individual factors predicting reactions to online harassment among Finnish professionals
1404,3,"[('exposure', 1)]","[('close', 10), ('in', 9), ('to', 8), ('elections', 7)]",[],"[('decrease', 1)]","[('data', 1)]",10.1016/j.tele.2021.101747,"How do we make the virtual world a better place? Social discrimination in online gaming, sense of community, and well-being"
1405,3,"[('behavior', 1)]","[('the', 13), ('to', 9), ('tax', 7), ('a', 7)]","[('control', 1), ('experiment', 1), ('call', 1), ('field', 1)]","[('increase', 1)]","[('channel', 1)]",10.1057/s41599-022-01069-9,Social axiom and group identity explain participation in a societal event in Hong Kong
1408,8,"[('exposure', 1), ('news', 1), ('information', 1), ('disinformation', 1)]","[('to', 8), ('the', 7), ('content', 6), ('news', 6)]","[('articles', 1), ('study', 1), ('difference', 1), ('experiment', 1)]",[],"[('online', 1), ('profile', 1), ('content', 1), ('video', 1)]",10.1386/eta_00082_1,Towards a pedagogy of reconciliation and transformation: A peace education through art initiative in response to 26/11
1409,4,"[('media', 1), ('information', 1), ('news', 1)]","[('of', 9), ('the', 7), ('in', 5), ('news', 5)]","[('result', 1), ('assessment', 1)]",[],"[('media', 1)]",10.1016/j.jesp.2022.104304,"Out of sight, out of mind: The emotional determinant of “harmful inaction” intergroup conflict"
1411,2,"[('social', 1), ('trust', 1)]","[('the', 10), ('in', 7), ('and', 7), ('of', 6)]","[('survey', 1), ('impact', 1)]","[('increase', 1), ('decrease', 1)]","[('social', 1)]",10.1177/1754073918798089,"Concluding Commentary: Schadenfreude, Gluckschmerz, Jealousy, and Hate—What (and When, and Why) Are the Emotions?"
1415,3,"[('belief', 1), ('misinformation', 1)]","[('in', 7), ('climate', 7), ('change', 7), ('attitudes', 6)]","[('control', 1), ('intervention', 1), ('meta-analysis', 1), ('positive', 1)]","[('intervention', 1)]",[],10.1556/2052.2020.00341,The genealogy of social hatred
